00:00.0 Host bridge [0600]: Intel Corporation Xeon E3-1200 v2/3rd Gen Core processor DRAM Controller [8086:0150] (rev 09)
	Subsystem: Intel Corporation Device [8086:2034]
	Control: I/O- Mem+ BusMaster+ SpecCycle- MemWINV- VGASnoop- ParErr- Stepping- SERR- FastB2B- DisINTx-
	Status: Cap+ 66MHz- UDF- FastB2B+ ParErr- DEVSEL=fast >TAbort- <TAbort- <MAbort+ >SERR- <PERR- INTx-
	Latency: 0
	Capabilities: [e0] Vendor Specific Information: Len=0c <?>
	Kernel driver in use: ivb_uncore
	Kernel modules: ie31200_edac
00: 86 80 50 01 06 00 90 20 09 00 00 06 00 00 00 00
10: 00 00 00 00 00 00 00 00 00 00 00 00 00 00 00 00
20: 00 00 00 00 00 00 00 00 00 00 00 00 86 80 34 20
30: 00 00 00 00 e0 00 00 00 00 00 00 00 00 00 00 00
40: 01 90 d1 fe 00 00 00 00 01 00 d1 fe 00 00 00 00
50: 11 02 00 00 11 00 00 00 07 00 90 df 01 00 00 db
60: 05 00 00 f8 00 00 00 00 01 80 d1 fe 00 00 00 00
70: 00 00 00 ff 03 00 00 00 00 0c 00 ff 7f 00 00 00
80: 10 11 11 00 00 11 11 00 1a 00 00 00 00 00 00 00
90: 01 00 00 ff 03 00 00 00 01 00 50 1f 04 00 00 00
a0: 01 00 00 00 04 00 00 00 01 00 60 1f 04 00 00 00
b0: 01 00 a0 db 01 00 80 db 01 00 00 db 01 00 a0 df
c0: 00 00 00 00 00 00 00 00 00 00 00 00 00 00 00 00
d0: 00 00 00 00 00 00 00 00 00 00 00 00 00 00 00 00
e0: 09 00 0c 01 92 80 80 e2 d0 00 40 04 00 00 00 00
f0: 00 00 00 00 00 00 00 00 c8 0f 09 00 00 00 00 00

00:02.0 VGA compatible controller [0300]: Intel Corporation Xeon E3-1200 v2/3rd Gen Core processor Graphics Controller [8086:0152] (rev 09) (prog-if 00 [VGA controller])
	DeviceName:  CPU
	Subsystem: Intel Corporation Device [8086:2034]
	Control: I/O+ Mem+ BusMaster+ SpecCycle- MemWINV- VGASnoop- ParErr- Stepping- SERR- FastB2B- DisINTx+
	Status: Cap+ 66MHz- UDF- FastB2B+ ParErr- DEVSEL=fast >TAbort- <TAbort- <MAbort- >SERR- <PERR- INTx-
	Latency: 0
	Interrupt: pin A routed to IRQ 29
	Region 0: Memory at f7800000 (64-bit, non-prefetchable) [size=4M]
	Region 2: Memory at e0000000 (64-bit, prefetchable) [size=256M]
	Region 4: I/O ports at f000 [size=64]
	Expansion ROM at 000c0000 [virtual] [disabled] [size=128K]
	Capabilities: [90] MSI: Enable+ Count=1/1 Maskable- 64bit-
		Address: fee08004  Data: 0022
	Capabilities: [d0] Power Management version 2
		Flags: PMEClk- DSI+ D1- D2- AuxCurrent=0mA PME(D0-,D1-,D2-,D3hot-,D3cold-)
		Status: D0 NoSoftRst- PME-Enable- DSel=0 DScale=0 PME-
	Capabilities: [a4] PCI Advanced Features
		AFCap: TP+ FLR+
		AFCtrl: FLR-
		AFStatus: TP-
	Kernel driver in use: i915
	Kernel modules: i915
00: 86 80 52 01 07 04 90 00 09 00 00 03 00 00 00 00
10: 04 00 80 f7 00 00 00 00 0c 00 00 e0 00 00 00 00
20: 01 f0 00 00 00 00 00 00 00 00 00 00 86 80 34 20
30: 00 00 00 00 90 00 00 00 00 00 00 00 0b 01 00 00
40: 09 00 0c 01 92 80 80 e2 d0 00 40 04 00 00 00 00
50: 11 02 00 00 11 00 00 00 00 00 00 00 01 00 a0 db
60: 00 00 02 00 00 00 00 00 00 00 00 00 00 00 00 00
70: 00 00 00 00 00 00 00 00 00 00 00 00 00 00 00 00
80: 00 00 00 00 00 00 00 00 00 00 00 00 00 00 00 00
90: 05 d0 01 00 04 80 e0 fe 22 00 00 00 00 00 00 00
a0: 00 00 00 00 13 00 06 03 00 00 00 00 00 00 00 00
b0: 00 00 00 00 00 00 00 00 00 00 00 00 00 00 00 00
c0: 00 00 00 00 00 00 00 00 00 00 00 00 00 00 00 00
d0: 01 a4 22 00 00 00 00 00 00 00 00 00 00 00 00 00
e0: 00 00 00 00 00 00 00 00 00 80 00 00 00 00 00 00
f0: 00 00 00 00 00 00 00 00 00 00 09 00 18 d0 3b da

00:14.0 USB controller [0c03]: Intel Corporation 7 Series/C210 Series Chipset Family USB xHCI Host Controller [8086:1e31] (rev 04) (prog-if 30 [XHCI])
	Subsystem: Intel Corporation Device [8086:2034]
	Control: I/O- Mem+ BusMaster+ SpecCycle- MemWINV- VGASnoop- ParErr- Stepping- SERR- FastB2B- DisINTx+
	Status: Cap+ 66MHz- UDF- FastB2B+ ParErr- DEVSEL=medium >TAbort- <TAbort- <MAbort- >SERR- <PERR- INTx-
	Latency: 0
	Interrupt: pin A routed to IRQ 27
	Region 0: Memory at f7d20000 (64-bit, non-prefetchable) [size=64K]
	Capabilities: [70] Power Management version 2
		Flags: PMEClk- DSI- D1- D2- AuxCurrent=375mA PME(D0-,D1-,D2-,D3hot+,D3cold+)
		Status: D0 NoSoftRst+ PME-Enable- DSel=0 DScale=0 PME-
	Capabilities: [80] MSI: Enable+ Count=1/8 Maskable- 64bit+
		Address: 00000000fee01004  Data: 0021
	Kernel driver in use: xhci_hcd
	Kernel modules: xhci_pci
00: 86 80 31 1e 06 04 90 02 04 30 03 0c 00 00 00 00
10: 04 00 d2 f7 00 00 00 00 00 00 00 00 00 00 00 00
20: 00 00 00 00 00 00 00 00 00 00 00 00 86 80 34 20
30: 00 00 00 00 70 00 00 00 00 00 00 00 0b 01 00 00
40: fd 07 0e 80 39 c2 03 80 00 00 00 00 00 00 00 00
50: 17 00 00 00 00 00 00 00 00 00 00 00 00 00 00 00
60: 30 20 00 00 00 00 00 00 00 00 00 00 00 00 00 00
70: 01 80 c2 c1 08 00 00 00 00 00 00 00 00 00 00 00
80: 05 00 87 00 04 10 e0 fe 00 00 00 00 21 00 00 00
90: 00 00 00 00 00 00 00 00 00 00 00 00 00 00 00 00
a0: 00 00 00 00 00 00 00 00 00 00 00 00 00 00 00 00
b0: 8f 00 00 00 00 00 00 00 00 00 00 00 00 00 00 00
c0: 03 0c 00 00 00 00 00 00 00 00 00 00 00 00 00 00
d0: 0f 00 00 00 0f 00 00 00 0f 00 00 00 0f 00 00 00
e0: 00 00 00 00 00 00 00 00 00 00 00 00 00 00 00 00
f0: 00 00 00 00 00 00 00 00 87 0f 04 08 00 00 00 00

00:16.0 Communication controller [0780]: Intel Corporation 7 Series/C216 Chipset Family MEI Controller #1 [8086:1e3a] (rev 04)
	Subsystem: Intel Corporation Device [8086:2034]
	Control: I/O- Mem+ BusMaster+ SpecCycle- MemWINV- VGASnoop- ParErr- Stepping- SERR- FastB2B- DisINTx+
	Status: Cap+ 66MHz- UDF- FastB2B- ParErr- DEVSEL=fast >TAbort- <TAbort- <MAbort- >SERR- <PERR- INTx-
	Latency: 0
	Interrupt: pin A routed to IRQ 30
	Region 0: Memory at f7d3b000 (64-bit, non-prefetchable) [size=16]
	Capabilities: [50] Power Management version 3
		Flags: PMEClk- DSI- D1- D2- AuxCurrent=0mA PME(D0+,D1-,D2-,D3hot+,D3cold+)
		Status: D0 NoSoftRst+ PME-Enable- DSel=0 DScale=0 PME-
	Capabilities: [8c] MSI: Enable+ Count=1/1 Maskable- 64bit+
		Address: 00000000fee01004  Data: 0022
	Kernel driver in use: mei_me
	Kernel modules: mei_me
00: 86 80 3a 1e 06 04 10 00 04 00 80 07 00 00 80 00
10: 04 b0 d3 f7 00 00 00 00 00 00 00 00 00 00 00 00
20: 00 00 00 00 00 00 00 00 00 00 00 00 86 80 34 20
30: 00 00 00 00 50 00 00 00 00 00 00 00 0b 01 00 00
40: 45 02 00 1e 10 00 01 80 06 01 00 66 f0 3f 00 10
50: 01 8c 03 c8 08 00 00 00 00 00 00 00 00 00 00 00
60: 00 00 00 00 00 00 00 00 00 00 00 00 00 00 00 00
70: 00 00 00 00 00 00 00 00 00 00 00 00 00 00 00 00
80: 00 00 00 00 00 00 00 00 00 00 00 00 05 00 81 00
90: 04 10 e0 fe 00 00 00 00 22 00 00 00 00 00 00 00
a0: 00 00 00 00 00 00 00 00 00 00 00 00 00 00 00 00
b0: 00 00 00 00 00 00 00 00 00 00 00 00 02 00 00 c0
c0: 81 10 fd 7a 3a 3b 1a 1c 38 71 ed 43 9f 2f b3 75
d0: a2 36 de c7 11 de e8 eb 74 20 85 aa 38 4e d9 a5
e0: 00 00 00 00 00 00 00 00 00 00 00 00 00 00 00 00
f0: 00 00 00 00 00 00 00 00 00 00 00 00 00 00 00 00

00:19.0 Ethernet controller [0200]: Intel Corporation 82579V Gigabit Network Connection [8086:1503] (rev 04)
	DeviceName:  LU1
	Subsystem: Intel Corporation Device [8086:2034]
	Control: I/O+ Mem+ BusMaster+ SpecCycle- MemWINV- VGASnoop- ParErr- Stepping- SERR- FastB2B- DisINTx+
	Status: Cap+ 66MHz- UDF- FastB2B- ParErr- DEVSEL=fast >TAbort- <TAbort- <MAbort- >SERR- <PERR- INTx-
	Latency: 0
	Interrupt: pin A routed to IRQ 28
	Region 0: Memory at f7d00000 (32-bit, non-prefetchable) [size=128K]
	Region 1: Memory at f7d39000 (32-bit, non-prefetchable) [size=4K]
	Region 2: I/O ports at f080 [size=32]
	Capabilities: [c8] Power Management version 2
		Flags: PMEClk- DSI+ D1- D2- AuxCurrent=0mA PME(D0+,D1-,D2-,D3hot+,D3cold+)
		Status: D0 NoSoftRst- PME-Enable- DSel=0 DScale=1 PME-
	Capabilities: [d0] MSI: Enable+ Count=1/1 Maskable- 64bit+
		Address: 00000000fee02004  Data: 0022
	Capabilities: [e0] PCI Advanced Features
		AFCap: TP+ FLR+
		AFCtrl: FLR-
		AFStatus: TP-
	Kernel driver in use: e1000e
	Kernel modules: e1000e
00: 86 80 03 15 07 04 10 00 04 00 00 02 00 00 00 00
10: 00 00 d0 f7 00 90 d3 f7 81 f0 00 00 00 00 00 00
20: 00 00 00 00 00 00 00 00 00 00 00 00 86 80 34 20
30: 00 00 00 00 c8 00 00 00 00 00 00 00 05 01 00 00
40: 00 00 00 00 00 00 00 00 00 00 00 00 00 00 00 00
50: 00 00 00 00 00 00 00 00 00 00 00 00 00 00 00 00
60: 00 00 00 00 00 00 00 00 00 00 00 00 00 00 00 00
70: 00 00 00 00 00 00 00 00 00 00 00 00 00 00 00 00
80: 00 00 00 00 00 00 00 00 00 00 00 00 00 00 00 00
90: 00 00 00 00 00 00 00 00 04 54 00 00 05 8c 00 80
a0: 00 00 00 00 00 00 00 00 00 00 00 00 00 00 00 00
b0: 00 00 00 00 00 00 00 00 00 00 00 00 00 00 00 00
c0: 00 00 00 00 00 00 00 00 01 d0 22 c8 00 20 00 07
d0: 05 e0 81 00 04 20 e0 fe 00 00 00 00 22 00 00 00
e0: 13 00 06 03 00 00 00 00 00 00 00 00 00 00 00 00
f0: 00 00 00 00 00 00 00 00 00 00 00 00 00 00 00 00

00:1a.0 USB controller [0c03]: Intel Corporation 7 Series/C216 Chipset Family USB Enhanced Host Controller #2 [8086:1e2d] (rev 04) (prog-if 20 [EHCI])
	Subsystem: Intel Corporation Device [8086:2034]
	Control: I/O- Mem+ BusMaster+ SpecCycle- MemWINV- VGASnoop- ParErr- Stepping- SERR- FastB2B- DisINTx-
	Status: Cap+ 66MHz- UDF- FastB2B+ ParErr- DEVSEL=medium >TAbort- <TAbort- <MAbort- >SERR- <PERR- INTx-
	Latency: 0
	Interrupt: pin A routed to IRQ 16
	Region 0: Memory at f7d38000 (32-bit, non-prefetchable) [size=1K]
	Capabilities: [50] Power Management version 2
		Flags: PMEClk- DSI- D1- D2- AuxCurrent=375mA PME(D0+,D1-,D2-,D3hot+,D3cold+)
		Status: D0 NoSoftRst- PME-Enable- DSel=0 DScale=0 PME-
	Capabilities: [58] Debug port: BAR=1 offset=00a0
	Capabilities: [98] PCI Advanced Features
		AFCap: TP+ FLR+
		AFCtrl: FLR-
		AFStatus: TP-
	Kernel driver in use: ehci-pci
00: 86 80 2d 1e 06 00 90 02 04 20 03 0c 00 00 00 00
10: 00 80 d3 f7 00 00 00 00 00 00 00 00 00 00 00 00
20: 00 00 00 00 00 00 00 00 00 00 00 00 86 80 34 20
30: 00 00 00 00 50 00 00 00 00 00 00 00 0b 01 00 00
40: 00 00 00 00 00 00 00 00 00 00 00 00 00 00 00 00
50: 01 58 c2 c9 00 00 00 00 0a 98 a0 20 00 00 00 00
60: 20 20 ff 07 00 00 00 00 01 00 00 01 00 00 08 40
70: 00 00 df 3f 00 00 00 00 00 00 00 00 00 00 00 00
80: 00 00 80 00 11 88 0c 93 30 0d 00 24 00 00 00 00
90: 00 00 00 00 00 00 00 00 13 00 06 03 00 00 00 00
a0: 00 00 00 00 00 00 00 00 00 00 00 00 00 00 00 00
b0: 00 00 00 00 00 00 00 00 00 00 00 00 00 00 00 00
c0: 00 00 00 00 00 00 00 00 00 00 00 00 00 00 00 00
d0: 00 00 00 00 00 aa ff 00 00 00 00 00 00 00 00 00
e0: 00 00 00 00 60 2a a5 e9 83 d0 e3 8b 04 a0 68 da
f0: 00 00 00 00 88 85 80 00 87 0f 04 08 08 17 5b 20

00:1b.0 Audio device [0403]: Intel Corporation 7 Series/C216 Chipset Family High Definition Audio Controller [8086:1e20] (rev 04)
	DeviceName:  AU1
	Subsystem: Intel Corporation Device [8086:2034]
	Control: I/O- Mem+ BusMaster+ SpecCycle- MemWINV- VGASnoop- ParErr- Stepping- SERR- FastB2B- DisINTx+
	Status: Cap+ 66MHz- UDF- FastB2B- ParErr- DEVSEL=fast >TAbort- <TAbort- <MAbort- >SERR- <PERR- INTx-
	Latency: 0, Cache Line Size: 64 bytes
	Interrupt: pin A routed to IRQ 31
	Region 0: Memory at f7d30000 (64-bit, non-prefetchable) [size=16K]
	Capabilities: [50] Power Management version 2
		Flags: PMEClk- DSI- D1- D2- AuxCurrent=55mA PME(D0+,D1-,D2-,D3hot+,D3cold+)
		Status: D0 NoSoftRst- PME-Enable- DSel=0 DScale=0 PME-
	Capabilities: [60] MSI: Enable+ Count=1/1 Maskable- 64bit+
		Address: 00000000fee04004  Data: 0023
	Capabilities: [70] Express (v1) Root Complex Integrated Endpoint, IntMsgNum 0
		DevCap:	MaxPayload 128 bytes, PhantFunc 0
			ExtTag- RBE- FLReset+ TEE-IO-
		DevCtl:	CorrErr- NonFatalErr- FatalErr- UnsupReq-
			RlxdOrd- ExtTag- PhantFunc- AuxPwr- NoSnoop- FLReset-
			MaxPayload 128 bytes, MaxReadReq 128 bytes
		DevSta:	CorrErr- NonFatalErr- FatalErr- UnsupReq- AuxPwr+ TransPend-
	Capabilities: [100 v1] Virtual Channel
		Caps:	LPEVC=0 RefClk=100ns PATEntryBits=1
		Arb:	Fixed- WRR32- WRR64- WRR128-
		Ctrl:	ArbSelect=Fixed
		Status:	InProgress-
		VC0:	Caps:	PATOffset=00 MaxTimeSlots=1 RejSnoopTrans-
			Arb:	Fixed- WRR32- WRR64- WRR128- TWRR128- WRR256-
			Ctrl:	Enable+ ID=0 ArbSelect=Fixed TC/VC=01
			Status:	NegoPending- InProgress-
		VC1:	Caps:	PATOffset=00 MaxTimeSlots=1 RejSnoopTrans-
			Arb:	Fixed- WRR32- WRR64- WRR128- TWRR128- WRR256-
			Ctrl:	Enable+ ID=1 ArbSelect=Fixed TC/VC=22
			Status:	NegoPending- InProgress-
	Capabilities: [130 v1] Root Complex Link
		Desc:	PortNumber=0f ComponentID=00 EltType=Config
		Link0:	Desc:	TargetPort=00 TargetComponent=00 AssocRCRB- LinkType=MemMapped LinkValid+
			Addr:	00000000fed1c000
	Kernel driver in use: snd_hda_intel
	Kernel modules: snd_hda_intel
00: 86 80 20 1e 06 04 10 00 04 00 03 04 10 00 00 00
10: 04 00 d3 f7 00 00 00 00 00 00 00 00 00 00 00 00
20: 00 00 00 00 00 00 00 00 00 00 00 00 86 80 34 20
30: 00 00 00 00 50 00 00 00 00 00 00 00 03 01 00 00
40: 01 00 00 45 00 00 00 00 00 00 00 00 00 00 00 00
50: 01 60 42 c8 00 00 00 00 00 00 00 00 00 00 00 00
60: 05 70 81 00 04 40 e0 fe 00 00 00 00 23 00 00 00
70: 10 00 91 00 00 00 00 10 00 00 10 00 00 00 00 00
80: 00 00 00 00 00 00 00 00 00 00 00 00 00 00 00 00
90: 00 00 00 00 00 00 00 00 00 00 00 00 00 00 00 00
a0: 00 00 00 00 00 00 00 00 00 00 00 00 00 00 00 00
b0: 00 00 00 00 00 00 00 00 00 00 00 00 00 00 00 00
c0: 00 04 02 01 02 24 00 40 00 0c a3 82 10 00 33 02
d0: 00 0c a3 02 10 00 33 02 00 00 00 00 00 00 00 00
e0: 00 00 00 00 00 00 00 00 00 00 00 00 00 00 00 00
f0: 00 00 00 00 00 00 00 00 87 0f 04 08 00 00 00 00
100: 02 00 01 13 01 00 00 00 00 00 00 00 00 00 00 00
110: 00 00 00 00 01 00 00 80 00 00 00 00 00 00 00 00
120: 22 00 00 81 00 00 00 00 00 00 00 00 00 00 00 00
130: 05 00 01 00 00 01 00 0f 00 00 00 00 00 00 00 00
140: 01 00 00 00 00 00 00 00 00 c0 d1 fe 00 00 00 00
150: 00 00 00 00 00 00 00 00 00 00 00 00 00 00 00 00
160: 00 00 00 00 00 00 00 00 00 00 00 00 00 00 00 00
170: 00 00 00 00 00 00 00 00 00 00 00 00 00 00 00 00
180: 00 00 00 00 00 00 00 00 00 00 00 00 00 00 00 00
190: 00 00 00 00 00 00 00 00 00 00 00 00 00 00 00 00
1a0: 00 00 00 00 00 00 00 00 00 00 00 00 00 00 00 00
1b0: 00 00 00 00 00 00 00 00 00 00 00 00 00 00 00 00
1c0: 00 00 00 00 00 00 00 00 00 00 00 00 00 00 00 00
1d0: 00 00 00 00 00 00 00 00 00 00 00 00 00 00 00 00
1e0: 00 00 00 00 00 00 00 00 00 00 00 00 00 00 00 00
1f0: 00 00 00 00 00 00 00 00 00 00 00 00 00 00 00 00
200: 00 00 00 00 00 00 00 00 00 00 00 00 00 00 00 00
210: 00 00 00 00 00 00 00 00 00 00 00 00 00 00 00 00
220: 00 00 00 00 00 00 00 00 00 00 00 00 00 00 00 00
230: 00 00 00 00 00 00 00 00 00 00 00 00 00 00 00 00
240: 00 00 00 00 00 00 00 00 00 00 00 00 00 00 00 00
250: 00 00 00 00 00 00 00 00 00 00 00 00 00 00 00 00
260: 00 00 00 00 00 00 00 00 00 00 00 00 00 00 00 00
270: 00 00 00 00 00 00 00 00 00 00 00 00 00 00 00 00
280: 00 00 00 00 00 00 00 00 00 00 00 00 00 00 00 00
290: 00 00 00 00 00 00 00 00 00 00 00 00 00 00 00 00
2a0: 00 00 00 00 00 00 00 00 00 00 00 00 00 00 00 00
2b0: 00 00 00 00 00 00 00 00 00 00 00 00 00 00 00 00
2c0: 00 00 00 00 00 00 00 00 00 00 00 00 00 00 00 00
2d0: 00 00 00 00 00 00 00 00 00 00 00 00 00 00 00 00
2e0: 00 00 00 00 00 00 00 00 00 00 00 00 00 00 00 00
2f0: 00 00 00 00 00 00 00 00 00 00 00 00 00 00 00 00
300: 00 00 00 00 00 00 00 00 00 00 00 00 00 00 00 00
310: 00 00 00 00 00 00 00 00 00 00 00 00 00 00 00 00
320: 00 00 00 00 00 00 00 00 00 00 00 00 00 00 00 00
330: 00 00 00 00 00 00 00 00 00 00 00 00 00 00 00 00
340: 00 00 00 00 00 00 00 00 00 00 00 00 00 00 00 00
350: 00 00 00 00 00 00 00 00 00 00 00 00 00 00 00 00
360: 00 00 00 00 00 00 00 00 00 00 00 00 00 00 00 00
370: 00 00 00 00 00 00 00 00 00 00 00 00 00 00 00 00
380: 00 00 00 00 00 00 00 00 00 00 00 00 00 00 00 00
390: 00 00 00 00 00 00 00 00 00 00 00 00 00 00 00 00
3a0: 00 00 00 00 00 00 00 00 00 00 00 00 00 00 00 00
3b0: 00 00 00 00 00 00 00 00 00 00 00 00 00 00 00 00
3c0: 00 00 00 00 00 00 00 00 00 00 00 00 00 00 00 00
3d0: 00 00 00 00 00 00 00 00 00 00 00 00 00 00 00 00
3e0: 00 00 00 00 00 00 00 00 00 00 00 00 00 00 00 00
3f0: 00 00 00 00 00 00 00 00 00 00 00 00 00 00 00 00
400: 00 00 00 00 00 00 00 00 00 00 00 00 00 00 00 00
410: 00 00 00 00 00 00 00 00 00 00 00 00 00 00 00 00
420: 00 00 00 00 00 00 00 00 00 00 00 00 00 00 00 00
430: 00 00 00 00 00 00 00 00 00 00 00 00 00 00 00 00
440: 00 00 00 00 00 00 00 00 00 00 00 00 00 00 00 00
450: 00 00 00 00 00 00 00 00 00 00 00 00 00 00 00 00
460: 00 00 00 00 00 00 00 00 00 00 00 00 00 00 00 00
470: 00 00 00 00 00 00 00 00 00 00 00 00 00 00 00 00
480: 00 00 00 00 00 00 00 00 00 00 00 00 00 00 00 00
490: 00 00 00 00 00 00 00 00 00 00 00 00 00 00 00 00
4a0: 00 00 00 00 00 00 00 00 00 00 00 00 00 00 00 00
4b0: 00 00 00 00 00 00 00 00 00 00 00 00 00 00 00 00
4c0: 00 00 00 00 00 00 00 00 00 00 00 00 00 00 00 00
4d0: 00 00 00 00 00 00 00 00 00 00 00 00 00 00 00 00
4e0: 00 00 00 00 00 00 00 00 00 00 00 00 00 00 00 00
4f0: 00 00 00 00 00 00 00 00 00 00 00 00 00 00 00 00
500: 00 00 00 00 00 00 00 00 00 00 00 00 00 00 00 00
510: 00 00 00 00 00 00 00 00 00 00 00 00 00 00 00 00
520: 00 00 00 00 00 00 00 00 00 00 00 00 00 00 00 00
530: 00 00 00 00 00 00 00 00 00 00 00 00 00 00 00 00
540: 00 00 00 00 00 00 00 00 00 00 00 00 00 00 00 00
550: 00 00 00 00 00 00 00 00 00 00 00 00 00 00 00 00
560: 00 00 00 00 00 00 00 00 00 00 00 00 00 00 00 00
570: 00 00 00 00 00 00 00 00 00 00 00 00 00 00 00 00
580: 00 00 00 00 00 00 00 00 00 00 00 00 00 00 00 00
590: 00 00 00 00 00 00 00 00 00 00 00 00 00 00 00 00
5a0: 00 00 00 00 00 00 00 00 00 00 00 00 00 00 00 00
5b0: 00 00 00 00 00 00 00 00 00 00 00 00 00 00 00 00
5c0: 00 00 00 00 00 00 00 00 00 00 00 00 00 00 00 00
5d0: 00 00 00 00 00 00 00 00 00 00 00 00 00 00 00 00
5e0: 00 00 00 00 00 00 00 00 00 00 00 00 00 00 00 00
5f0: 00 00 00 00 00 00 00 00 00 00 00 00 00 00 00 00
600: 00 00 00 00 00 00 00 00 00 00 00 00 00 00 00 00
610: 00 00 00 00 00 00 00 00 00 00 00 00 00 00 00 00
620: 00 00 00 00 00 00 00 00 00 00 00 00 00 00 00 00
630: 00 00 00 00 00 00 00 00 00 00 00 00 00 00 00 00
640: 00 00 00 00 00 00 00 00 00 00 00 00 00 00 00 00
650: 00 00 00 00 00 00 00 00 00 00 00 00 00 00 00 00
660: 00 00 00 00 00 00 00 00 00 00 00 00 00 00 00 00
670: 00 00 00 00 00 00 00 00 00 00 00 00 00 00 00 00
680: 00 00 00 00 00 00 00 00 00 00 00 00 00 00 00 00
690: 00 00 00 00 00 00 00 00 00 00 00 00 00 00 00 00
6a0: 00 00 00 00 00 00 00 00 00 00 00 00 00 00 00 00
6b0: 00 00 00 00 00 00 00 00 00 00 00 00 00 00 00 00
6c0: 00 00 00 00 00 00 00 00 00 00 00 00 00 00 00 00
6d0: 00 00 00 00 00 00 00 00 00 00 00 00 00 00 00 00
6e0: 00 00 00 00 00 00 00 00 00 00 00 00 00 00 00 00
6f0: 00 00 00 00 00 00 00 00 00 00 00 00 00 00 00 00
700: 00 00 00 00 00 00 00 00 00 00 00 00 00 00 00 00
710: 00 00 00 00 00 00 00 00 00 00 00 00 00 00 00 00
720: 00 00 00 00 00 00 00 00 00 00 00 00 00 00 00 00
730: 00 00 00 00 00 00 00 00 00 00 00 00 00 00 00 00
740: 00 00 00 00 00 00 00 00 00 00 00 00 00 00 00 00
750: 00 00 00 00 00 00 00 00 00 00 00 00 00 00 00 00
760: 00 00 00 00 00 00 00 00 00 00 00 00 00 00 00 00
770: 00 00 00 00 00 00 00 00 00 00 00 00 00 00 00 00
780: 00 00 00 00 00 00 00 00 00 00 00 00 00 00 00 00
790: 00 00 00 00 00 00 00 00 00 00 00 00 00 00 00 00
7a0: 00 00 00 00 00 00 00 00 00 00 00 00 00 00 00 00
7b0: 00 00 00 00 00 00 00 00 00 00 00 00 00 00 00 00
7c0: 00 00 00 00 00 00 00 00 00 00 00 00 00 00 00 00
7d0: 00 00 00 00 00 00 00 00 00 00 00 00 00 00 00 00
7e0: 00 00 00 00 00 00 00 00 00 00 00 00 00 00 00 00
7f0: 00 00 00 00 00 00 00 00 00 00 00 00 00 00 00 00
800: 00 00 00 00 00 00 00 00 00 00 00 00 00 00 00 00
810: 00 00 00 00 00 00 00 00 00 00 00 00 00 00 00 00
820: 00 00 00 00 00 00 00 00 00 00 00 00 00 00 00 00
830: 00 00 00 00 00 00 00 00 00 00 00 00 00 00 00 00
840: 00 00 00 00 00 00 00 00 00 00 00 00 00 00 00 00
850: 00 00 00 00 00 00 00 00 00 00 00 00 00 00 00 00
860: 00 00 00 00 00 00 00 00 00 00 00 00 00 00 00 00
870: 00 00 00 00 00 00 00 00 00 00 00 00 00 00 00 00
880: 00 00 00 00 00 00 00 00 00 00 00 00 00 00 00 00
890: 00 00 00 00 00 00 00 00 00 00 00 00 00 00 00 00
8a0: 00 00 00 00 00 00 00 00 00 00 00 00 00 00 00 00
8b0: 00 00 00 00 00 00 00 00 00 00 00 00 00 00 00 00
8c0: 00 00 00 00 00 00 00 00 00 00 00 00 00 00 00 00
8d0: 00 00 00 00 00 00 00 00 00 00 00 00 00 00 00 00
8e0: 00 00 00 00 00 00 00 00 00 00 00 00 00 00 00 00
8f0: 00 00 00 00 00 00 00 00 00 00 00 00 00 00 00 00
900: 00 00 00 00 00 00 00 00 00 00 00 00 00 00 00 00
910: 00 00 00 00 00 00 00 00 00 00 00 00 00 00 00 00
920: 00 00 00 00 00 00 00 00 00 00 00 00 00 00 00 00
930: 00 00 00 00 00 00 00 00 00 00 00 00 00 00 00 00
940: 00 00 00 00 00 00 00 00 00 00 00 00 00 00 00 00
950: 00 00 00 00 00 00 00 00 00 00 00 00 00 00 00 00
960: 00 00 00 00 00 00 00 00 00 00 00 00 00 00 00 00
970: 00 00 00 00 00 00 00 00 00 00 00 00 00 00 00 00
980: 00 00 00 00 00 00 00 00 00 00 00 00 00 00 00 00
990: 00 00 00 00 00 00 00 00 00 00 00 00 00 00 00 00
9a0: 00 00 00 00 00 00 00 00 00 00 00 00 00 00 00 00
9b0: 00 00 00 00 00 00 00 00 00 00 00 00 00 00 00 00
9c0: 00 00 00 00 00 00 00 00 00 00 00 00 00 00 00 00
9d0: 00 00 00 00 00 00 00 00 00 00 00 00 00 00 00 00
9e0: 00 00 00 00 00 00 00 00 00 00 00 00 00 00 00 00
9f0: 00 00 00 00 00 00 00 00 00 00 00 00 00 00 00 00
a00: 00 00 00 00 00 00 00 00 00 00 00 00 00 00 00 00
a10: 00 00 00 00 00 00 00 00 00 00 00 00 00 00 00 00
a20: 00 00 00 00 00 00 00 00 00 00 00 00 00 00 00 00
a30: 00 00 00 00 00 00 00 00 00 00 00 00 00 00 00 00
a40: 00 00 00 00 00 00 00 00 00 00 00 00 00 00 00 00
a50: 00 00 00 00 00 00 00 00 00 00 00 00 00 00 00 00
a60: 00 00 00 00 00 00 00 00 00 00 00 00 00 00 00 00
a70: 00 00 00 00 00 00 00 00 00 00 00 00 00 00 00 00
a80: 00 00 00 00 00 00 00 00 00 00 00 00 00 00 00 00
a90: 00 00 00 00 00 00 00 00 00 00 00 00 00 00 00 00
aa0: 00 00 00 00 00 00 00 00 00 00 00 00 00 00 00 00
ab0: 00 00 00 00 00 00 00 00 00 00 00 00 00 00 00 00
ac0: 00 00 00 00 00 00 00 00 00 00 00 00 00 00 00 00
ad0: 00 00 00 00 00 00 00 00 00 00 00 00 00 00 00 00
ae0: 00 00 00 00 00 00 00 00 00 00 00 00 00 00 00 00
af0: 00 00 00 00 00 00 00 00 00 00 00 00 00 00 00 00
b00: 00 00 00 00 00 00 00 00 00 00 00 00 00 00 00 00
b10: 00 00 00 00 00 00 00 00 00 00 00 00 00 00 00 00
b20: 00 00 00 00 00 00 00 00 00 00 00 00 00 00 00 00
b30: 00 00 00 00 00 00 00 00 00 00 00 00 00 00 00 00
b40: 00 00 00 00 00 00 00 00 00 00 00 00 00 00 00 00
b50: 00 00 00 00 00 00 00 00 00 00 00 00 00 00 00 00
b60: 00 00 00 00 00 00 00 00 00 00 00 00 00 00 00 00
b70: 00 00 00 00 00 00 00 00 00 00 00 00 00 00 00 00
b80: 00 00 00 00 00 00 00 00 00 00 00 00 00 00 00 00
b90: 00 00 00 00 00 00 00 00 00 00 00 00 00 00 00 00
ba0: 00 00 00 00 00 00 00 00 00 00 00 00 00 00 00 00
bb0: 00 00 00 00 00 00 00 00 00 00 00 00 00 00 00 00
bc0: 00 00 00 00 00 00 00 00 00 00 00 00 00 00 00 00
bd0: 00 00 00 00 00 00 00 00 00 00 00 00 00 00 00 00
be0: 00 00 00 00 00 00 00 00 00 00 00 00 00 00 00 00
bf0: 00 00 00 00 00 00 00 00 00 00 00 00 00 00 00 00
c00: 00 00 00 00 00 00 00 00 00 00 00 00 00 00 00 00
c10: 00 00 00 00 00 00 00 00 00 00 00 00 00 00 00 00
c20: 00 00 00 00 00 00 00 00 00 00 00 00 00 00 00 00
c30: 00 00 00 00 00 00 00 00 00 00 00 00 00 00 00 00
c40: 00 00 00 00 00 00 00 00 00 00 00 00 00 00 00 00
c50: 00 00 00 00 00 00 00 00 00 00 00 00 00 00 00 00
c60: 00 00 00 00 00 00 00 00 00 00 00 00 00 00 00 00
c70: 00 00 00 00 00 00 00 00 00 00 00 00 00 00 00 00
c80: 00 00 00 00 00 00 00 00 00 00 00 00 00 00 00 00
c90: 00 00 00 00 00 00 00 00 00 00 00 00 00 00 00 00
ca0: 00 00 00 00 00 00 00 00 00 00 00 00 00 00 00 00
cb0: 00 00 00 00 00 00 00 00 00 00 00 00 00 00 00 00
cc0: 00 00 00 00 00 00 00 00 00 00 00 00 00 00 00 00
cd0: 00 00 00 00 00 00 00 00 00 00 00 00 00 00 00 00
ce0: 00 00 00 00 00 00 00 00 00 00 00 00 00 00 00 00
cf0: 00 00 00 00 00 00 00 00 00 00 00 00 00 00 00 00
d00: 00 00 00 00 00 00 00 00 00 00 00 00 00 00 00 00
d10: 00 00 00 00 00 00 00 00 00 00 00 00 00 00 00 00
d20: 00 00 00 00 00 00 00 00 00 00 00 00 00 00 00 00
d30: 00 00 00 00 00 00 00 00 00 00 00 00 00 00 00 00
d40: 00 00 00 00 00 00 00 00 00 00 00 00 00 00 00 00
d50: 00 00 00 00 00 00 00 00 00 00 00 00 00 00 00 00
d60: 00 00 00 00 00 00 00 00 00 00 00 00 00 00 00 00
d70: 00 00 00 00 00 00 00 00 00 00 00 00 00 00 00 00
d80: 00 00 00 00 00 00 00 00 00 00 00 00 00 00 00 00
d90: 00 00 00 00 00 00 00 00 00 00 00 00 00 00 00 00
da0: 00 00 00 00 00 00 00 00 00 00 00 00 00 00 00 00
db0: 00 00 00 00 00 00 00 00 00 00 00 00 00 00 00 00
dc0: 00 00 00 00 00 00 00 00 00 00 00 00 00 00 00 00
dd0: 00 00 00 00 00 00 00 00 00 00 00 00 00 00 00 00
de0: 00 00 00 00 00 00 00 00 00 00 00 00 00 00 00 00
df0: 00 00 00 00 00 00 00 00 00 00 00 00 00 00 00 00
e00: 00 00 00 00 00 00 00 00 00 00 00 00 00 00 00 00
e10: 00 00 00 00 00 00 00 00 00 00 00 00 00 00 00 00
e20: 00 00 00 00 00 00 00 00 00 00 00 00 00 00 00 00
e30: 00 00 00 00 00 00 00 00 00 00 00 00 00 00 00 00
e40: 00 00 00 00 00 00 00 00 00 00 00 00 00 00 00 00
e50: 00 00 00 00 00 00 00 00 00 00 00 00 00 00 00 00
e60: 00 00 00 00 00 00 00 00 00 00 00 00 00 00 00 00
e70: 00 00 00 00 00 00 00 00 00 00 00 00 00 00 00 00
e80: 00 00 00 00 00 00 00 00 00 00 00 00 00 00 00 00
e90: 00 00 00 00 00 00 00 00 00 00 00 00 00 00 00 00
ea0: 00 00 00 00 00 00 00 00 00 00 00 00 00 00 00 00
eb0: 00 00 00 00 00 00 00 00 00 00 00 00 00 00 00 00
ec0: 00 00 00 00 00 00 00 00 00 00 00 00 00 00 00 00
ed0: 00 00 00 00 00 00 00 00 00 00 00 00 00 00 00 00
ee0: 00 00 00 00 00 00 00 00 00 00 00 00 00 00 00 00
ef0: 00 00 00 00 00 00 00 00 00 00 00 00 00 00 00 00
f00: 00 00 00 00 00 00 00 00 00 00 00 00 00 00 00 00
f10: 00 00 00 00 00 00 00 00 00 00 00 00 00 00 00 00
f20: 00 00 00 00 00 00 00 00 00 00 00 00 00 00 00 00
f30: 00 00 00 00 00 00 00 00 00 00 00 00 00 00 00 00
f40: 00 00 00 00 00 00 00 00 00 00 00 00 00 00 00 00
f50: 00 00 00 00 00 00 00 00 00 00 00 00 00 00 00 00
f60: 00 00 00 00 00 00 00 00 00 00 00 00 00 00 00 00
f70: 00 00 00 00 00 00 00 00 00 00 00 00 00 00 00 00
f80: 00 00 00 00 00 00 00 00 00 00 00 00 00 00 00 00
f90: 00 00 00 00 00 00 00 00 00 00 00 00 00 00 00 00
fa0: 00 00 00 00 00 00 00 00 00 00 00 00 00 00 00 00
fb0: 00 00 00 00 00 00 00 00 00 00 00 00 00 00 00 00
fc0: 00 00 00 00 00 00 00 00 00 00 00 00 00 00 00 00
fd0: 00 00 00 00 00 00 00 00 00 00 00 00 00 00 00 00
fe0: 00 00 00 00 00 00 00 00 00 00 00 00 00 00 00 00
ff0: 00 00 00 00 00 00 00 00 00 00 00 00 00 00 00 00

00:1c.0 PCI bridge [0604]: Intel Corporation 7 Series/C216 Chipset Family PCI Express Root Port 1 [8086:1e10] (rev c4) (prog-if 00 [Normal decode])
	Subsystem: Intel Corporation Device [8086:2034]
	Control: I/O+ Mem+ BusMaster+ SpecCycle- MemWINV- VGASnoop- ParErr- Stepping- SERR- FastB2B- DisINTx+
	Status: Cap+ 66MHz- UDF- FastB2B- ParErr- DEVSEL=fast >TAbort- <TAbort- <MAbort- >SERR- <PERR- INTx-
	Latency: 0, Cache Line Size: 64 bytes
	Interrupt: pin A routed to IRQ 24
	Bus: primary=00, secondary=01, subordinate=01, sec-latency=0
	I/O behind bridge: f000-0fff [disabled] [16-bit]
	Memory behind bridge: fff00000-000fffff [disabled] [32-bit]
	Prefetchable memory behind bridge: 00000000fff00000-00000000000fffff [disabled] [64-bit]
	Secondary status: 66MHz- FastB2B- ParErr- DEVSEL=fast >TAbort- <TAbort- <MAbort+ <SERR- <PERR-
	BridgeCtl: Parity- SERR+ NoISA- VGA- VGA16+ MAbort- >Reset- FastB2B-
		PriDiscTmr- SecDiscTmr- DiscTmrStat- DiscTmrSERREn-
	Capabilities: [40] Express (v2) Root Port (Slot+), IntMsgNum 0
		DevCap:	MaxPayload 128 bytes, PhantFunc 0
			ExtTag- RBE+ TEE-IO-
		DevCtl:	CorrErr- NonFatalErr- FatalErr- UnsupReq-
			RlxdOrd- ExtTag- PhantFunc- AuxPwr- NoSnoop-
			MaxPayload 128 bytes, MaxReadReq 128 bytes
		DevSta:	CorrErr- NonFatalErr- FatalErr- UnsupReq- AuxPwr+ TransPend-
		LnkCap:	Port #1, Speed 5GT/s, Width x1, ASPM L0s L1, Exit Latency L0s <1us, L1 <16us
			ClockPM- Surprise- LLActRep+ BwNot- ASPMOptComp-
		LnkCtl:	ASPM L0s L1 Enabled; RCB 64 bytes, LnkDisable- CommClk-
			ExtSynch- ClockPM- AutWidDis- BWInt- AutBWInt-
		LnkSta:	Speed 2.5GT/s, Width x0
			TrErr- Train- SlotClk+ DLActive- BWMgmt- ABWMgmt-
		SltCap:	AttnBtn- PwrCtrl- MRL- AttnInd- PwrInd- HotPlug- Surprise-
			Slot #0, PowerLimit 10W; Interlock- NoCompl+
		SltCtl:	Enable: AttnBtn- PwrFlt- MRL- PresDet- CmdCplt- HPIrq- LinkChg-
			Control: AttnInd Unknown, PwrInd Unknown, Power- Interlock-
		SltSta:	Status: AttnBtn- PowerFlt- MRL- CmdCplt- PresDet- Interlock-
			Changed: MRL- PresDet- LinkState-
		RootCap: CRSVisible-
		RootCtl: ErrCorrectable- ErrNon-Fatal- ErrFatal- PMEIntEna+ CRSVisible-
		RootSta: PME ReqID 0000, PMEStatus- PMEPending-
		DevCap2: Completion Timeout: Range BC, TimeoutDis+ NROPrPrP- LTR-
			 10BitTagComp- 10BitTagReq- OBFF Not Supported, ExtFmt- EETLPPrefix-
			 EmergencyPowerReduction Not Supported, EmergencyPowerReductionInit-
			 FRS- LN System CLS Not Supported, TPHComp- ExtTPHComp- ARIFwd-
			 AtomicOpsCap: Routing- 32bit- 64bit- 128bitCAS-
		DevCtl2: Completion Timeout: 50us to 50ms, TimeoutDis- ARIFwd-
			 AtomicOpsCtl: ReqEn- EgressBlck-
			 IDOReq- IDOCompl- LTR- EmergencyPowerReductionReq-
			 10BitTagReq- OBFF Disabled, EETLPPrefixBlk-
		LnkCtl2: Target Link Speed: 2.5GT/s, EnterCompliance- SpeedDis-
			 Transmit Margin: Normal Operating Range, EnterModifiedCompliance- ComplianceSOS-
			 Compliance Preset/De-emphasis: -6dB de-emphasis, 0dB preshoot
		LnkSta2: Current De-emphasis Level: -3.5dB, EqualizationComplete- EqualizationPhase1-
			 EqualizationPhase2- EqualizationPhase3- LinkEqualizationRequest-
			 Retimer- 2Retimers- CrosslinkRes: unsupported
	Capabilities: [80] MSI: Enable+ Count=1/1 Maskable- 64bit-
		Address: fee04004  Data: 0020
	Capabilities: [90] Subsystem: Intel Corporation Device [8086:2034]
	Capabilities: [a0] Power Management version 2
		Flags: PMEClk- DSI- D1- D2- AuxCurrent=0mA PME(D0+,D1-,D2-,D3hot+,D3cold+)
		Status: D3 NoSoftRst- PME-Enable+ DSel=0 DScale=0 PME-
	Kernel driver in use: pcieport
00: 86 80 10 1e 07 04 10 00 c4 00 04 06 10 00 81 00
10: 00 00 00 00 00 00 00 00 00 01 01 00 f0 00 00 20
20: f0 ff 00 00 f1 ff 01 00 00 00 00 00 00 00 00 00
30: 00 00 00 00 40 00 00 00 00 00 00 00 0b 01 12 00
40: 10 80 42 01 00 80 00 00 00 00 10 00 12 4c 12 01
50: 03 00 01 10 00 b2 04 00 00 00 00 00 08 00 00 00
60: 00 00 00 00 16 00 00 00 00 00 00 00 00 00 00 00
70: 01 00 01 00 00 00 00 00 00 00 00 00 00 00 00 00
80: 05 90 01 00 04 40 e0 fe 20 00 00 00 00 00 00 00
90: 0d a0 00 00 86 80 34 20 00 00 00 00 00 00 00 00
a0: 01 00 02 c8 03 01 00 00 00 00 00 00 00 00 00 00
b0: 00 00 00 00 00 00 00 00 00 00 00 00 00 00 00 00
c0: 00 00 00 00 00 00 00 00 00 00 00 00 00 00 00 00
d0: 00 00 00 01 02 0b 00 00 00 80 11 01 00 00 00 00
e0: 00 3f 00 00 00 00 00 00 03 00 00 00 00 00 00 00
f0: 00 00 00 00 00 00 00 00 87 0f 04 08 00 00 00 00
100: 00 00 00 00 00 00 00 00 00 00 00 00 11 00 06 00
110: 00 00 00 00 00 20 00 00 00 00 00 00 00 00 00 00
120: 00 00 00 00 00 00 00 00 00 00 00 00 00 00 00 00
130: 00 00 00 00 00 00 00 00 00 00 00 00 00 00 00 00
140: 00 00 00 00 00 00 00 00 00 00 00 00 00 00 00 00
150: 00 00 00 00 00 00 00 00 00 00 00 00 00 00 00 00
160: 00 00 00 00 00 00 00 00 00 00 00 00 00 00 00 00
170: 00 00 00 00 00 00 00 00 00 00 00 00 00 00 00 00
180: 00 00 00 00 00 00 00 00 00 00 00 00 00 00 00 00
190: 00 00 00 00 00 00 00 00 00 00 00 00 00 00 00 00
1a0: 00 00 00 00 00 00 00 00 00 00 00 00 00 00 00 00
1b0: 00 00 00 00 00 00 00 00 00 00 00 00 00 00 00 00
1c0: 00 00 00 00 00 00 00 00 00 00 00 00 00 00 00 00
1d0: 00 00 00 00 00 00 00 00 00 00 00 00 00 00 00 00
1e0: 00 00 00 00 00 00 00 00 00 00 00 00 00 00 00 00
1f0: 00 00 00 00 00 00 00 00 00 00 00 00 00 00 00 00
200: 00 00 00 00 00 00 00 00 00 00 00 00 00 00 00 00
210: 00 00 00 00 00 00 00 00 00 00 00 00 00 00 00 00
220: 00 00 00 00 00 00 00 00 00 00 00 00 00 00 00 00
230: 00 00 00 00 00 00 00 00 00 00 00 00 00 00 00 00
240: 00 00 00 00 00 00 00 00 00 00 00 00 00 00 00 00
250: 00 00 00 00 00 00 00 00 00 00 00 00 00 00 00 00
260: 00 00 00 00 00 00 00 00 00 00 00 00 00 00 00 00
270: 00 00 00 00 00 00 00 00 00 00 00 00 00 00 00 00
280: 00 00 00 00 00 00 00 00 00 00 00 00 00 00 00 00
290: 00 00 00 00 00 00 00 00 00 00 00 00 00 00 00 00
2a0: 00 00 00 00 00 00 00 00 00 00 00 00 00 00 00 00
2b0: 00 00 00 00 00 00 00 00 00 00 00 00 00 00 00 00
2c0: 00 00 00 00 00 00 00 00 00 00 00 00 00 00 00 00
2d0: 00 00 00 00 00 00 00 00 00 00 00 00 00 00 00 00
2e0: 00 00 00 00 00 00 00 00 00 00 00 00 00 00 00 00
2f0: 00 00 00 00 00 00 00 00 00 00 00 00 00 00 00 00
300: 00 00 00 00 00 00 00 00 00 00 00 00 00 00 00 00
310: 00 00 00 00 1b 36 3a 74 00 00 14 14 31 17 42 00
320: 5b 60 09 00 20 20 00 0a 00 00 00 00 ff 0f 00 00
330: 16 00 00 28 bc b5 bc 4a 00 00 00 00 74 4c 85 00
340: 00 00 00 00 00 00 00 00 30 00 0c 00 00 00 00 00
350: 00 00 00 00 01 00 08 00 00 00 00 00 00 00 00 00
360: 00 00 00 00 00 00 00 00 00 00 00 00 00 00 00 00
370: 00 00 00 00 00 00 00 00 00 00 00 00 00 00 00 00
380: 00 00 00 00 00 00 00 00 00 00 00 00 00 00 00 00
390: 00 00 00 00 00 00 00 00 00 00 00 00 00 00 00 00
3a0: 00 00 00 00 00 00 00 00 00 00 00 00 00 00 00 00
3b0: 00 00 00 00 00 00 00 00 00 00 00 00 00 00 00 00
3c0: 00 00 00 00 00 00 00 00 00 00 00 00 00 00 00 00
3d0: 00 00 00 00 00 00 00 00 00 00 00 00 00 00 00 00
3e0: 00 00 00 00 00 00 00 00 00 00 00 00 00 00 00 00
3f0: 00 00 00 00 00 00 00 00 00 00 00 00 00 00 00 00
400: 00 00 00 00 00 00 00 00 00 00 00 00 00 00 00 00
410: 00 00 00 00 00 00 00 00 00 00 00 00 00 00 00 00
420: 00 00 00 00 00 00 00 00 00 00 00 00 00 00 00 00
430: 00 00 00 00 00 00 00 00 00 00 00 00 00 00 00 00
440: 00 00 00 00 00 00 00 00 00 00 00 00 00 00 00 00
450: 00 00 00 00 00 00 00 00 00 00 00 00 00 00 00 00
460: 00 00 00 00 00 00 00 00 00 00 00 00 00 00 00 00
470: 00 00 00 00 00 00 00 00 00 00 00 00 00 00 00 00
480: 00 00 00 00 00 00 00 00 00 00 00 00 00 00 00 00
490: 00 00 00 00 00 00 00 00 00 00 00 00 00 00 00 00
4a0: 00 00 00 00 00 00 00 00 00 00 00 00 00 00 00 00
4b0: 00 00 00 00 00 00 00 00 00 00 00 00 00 00 00 00
4c0: 00 00 00 00 00 00 00 00 00 00 00 00 00 00 00 00
4d0: 00 00 00 00 00 00 00 00 00 00 00 00 00 00 00 00
4e0: 00 00 00 00 00 00 00 00 00 00 00 00 00 00 00 00
4f0: 00 00 00 00 00 00 00 00 00 00 00 00 00 00 00 00
500: 00 00 00 00 00 00 00 00 00 00 00 00 00 00 00 00
510: 00 00 00 00 00 00 00 00 00 00 00 00 00 00 00 00
520: 00 00 00 00 00 00 00 00 00 00 00 00 00 00 00 00
530: 00 00 00 00 00 00 00 00 00 00 00 00 00 00 00 00
540: 00 00 00 00 00 00 00 00 00 00 00 00 00 00 00 00
550: 00 00 00 00 00 00 00 00 00 00 00 00 00 00 00 00
560: 00 00 00 00 00 00 00 00 00 00 00 00 00 00 00 00
570: 00 00 00 00 00 00 00 00 00 00 00 00 00 00 00 00
580: 00 00 00 00 00 00 00 00 00 00 00 00 00 00 00 00
590: 00 00 00 00 00 00 00 00 00 00 00 00 00 00 00 00
5a0: 00 00 00 00 00 00 00 00 00 00 00 00 00 00 00 00
5b0: 00 00 00 00 00 00 00 00 00 00 00 00 00 00 00 00
5c0: 00 00 00 00 00 00 00 00 00 00 00 00 00 00 00 00
5d0: 00 00 00 00 00 00 00 00 00 00 00 00 00 00 00 00
5e0: 00 00 00 00 00 00 00 00 00 00 00 00 00 00 00 00
5f0: 00 00 00 00 00 00 00 00 00 00 00 00 00 00 00 00
600: 00 00 00 00 00 00 00 00 00 00 00 00 00 00 00 00
610: 00 00 00 00 00 00 00 00 00 00 00 00 00 00 00 00
620: 00 00 00 00 00 00 00 00 00 00 00 00 00 00 00 00
630: 00 00 00 00 00 00 00 00 00 00 00 00 00 00 00 00
640: 00 00 00 00 00 00 00 00 00 00 00 00 00 00 00 00
650: 00 00 00 00 00 00 00 00 00 00 00 00 00 00 00 00
660: 00 00 00 00 00 00 00 00 00 00 00 00 00 00 00 00
670: 00 00 00 00 00 00 00 00 00 00 00 00 00 00 00 00
680: 00 00 00 00 00 00 00 00 00 00 00 00 00 00 00 00
690: 00 00 00 00 00 00 00 00 00 00 00 00 00 00 00 00
6a0: 00 00 00 00 00 00 00 00 00 00 00 00 00 00 00 00
6b0: 00 00 00 00 00 00 00 00 00 00 00 00 00 00 00 00
6c0: 00 00 00 00 00 00 00 00 00 00 00 00 00 00 00 00
6d0: 00 00 00 00 00 00 00 00 00 00 00 00 00 00 00 00
6e0: 00 00 00 00 00 00 00 00 00 00 00 00 00 00 00 00
6f0: 00 00 00 00 00 00 00 00 00 00 00 00 00 00 00 00
700: 00 00 00 00 00 00 00 00 00 00 00 00 00 00 00 00
710: 00 00 00 00 00 00 00 00 00 00 00 00 00 00 00 00
720: 00 00 00 00 00 00 00 00 00 00 00 00 00 00 00 00
730: 00 00 00 00 00 00 00 00 00 00 00 00 00 00 00 00
740: 00 00 00 00 00 00 00 00 00 00 00 00 00 00 00 00
750: 00 00 00 00 00 00 00 00 00 00 00 00 00 00 00 00
760: 00 00 00 00 00 00 00 00 00 00 00 00 00 00 00 00
770: 00 00 00 00 00 00 00 00 00 00 00 00 00 00 00 00
780: 00 00 00 00 00 00 00 00 00 00 00 00 00 00 00 00
790: 00 00 00 00 00 00 00 00 00 00 00 00 00 00 00 00
7a0: 00 00 00 00 00 00 00 00 00 00 00 00 00 00 00 00
7b0: 00 00 00 00 00 00 00 00 00 00 00 00 00 00 00 00
7c0: 00 00 00 00 00 00 00 00 00 00 00 00 00 00 00 00
7d0: 00 00 00 00 00 00 00 00 00 00 00 00 00 00 00 00
7e0: 00 00 00 00 00 00 00 00 00 00 00 00 00 00 00 00
7f0: 00 00 00 00 00 00 00 00 00 00 00 00 00 00 00 00
800: 00 00 00 00 00 00 00 00 00 00 00 00 00 00 00 00
810: 00 00 00 00 00 00 00 00 00 00 00 00 00 00 00 00
820: 00 00 00 00 00 00 00 00 00 00 00 00 00 00 00 00
830: 00 00 00 00 00 00 00 00 00 00 00 00 00 00 00 00
840: 00 00 00 00 00 00 00 00 00 00 00 00 00 00 00 00
850: 00 00 00 00 00 00 00 00 00 00 00 00 00 00 00 00
860: 00 00 00 00 00 00 00 00 00 00 00 00 00 00 00 00
870: 00 00 00 00 00 00 00 00 00 00 00 00 00 00 00 00
880: 00 00 00 00 00 00 00 00 00 00 00 00 00 00 00 00
890: 00 00 00 00 00 00 00 00 00 00 00 00 00 00 00 00
8a0: 00 00 00 00 00 00 00 00 00 00 00 00 00 00 00 00
8b0: 00 00 00 00 00 00 00 00 00 00 00 00 00 00 00 00
8c0: 00 00 00 00 00 00 00 00 00 00 00 00 00 00 00 00
8d0: 00 00 00 00 00 00 00 00 00 00 00 00 00 00 00 00
8e0: 00 00 00 00 00 00 00 00 00 00 00 00 00 00 00 00
8f0: 00 00 00 00 00 00 00 00 00 00 00 00 00 00 00 00
900: 00 00 00 00 00 00 00 00 00 00 00 00 00 00 00 00
910: 00 00 00 00 00 00 00 00 00 00 00 00 00 00 00 00
920: 00 00 00 00 00 00 00 00 00 00 00 00 00 00 00 00
930: 00 00 00 00 00 00 00 00 00 00 00 00 00 00 00 00
940: 00 00 00 00 00 00 00 00 00 00 00 00 00 00 00 00
950: 00 00 00 00 00 00 00 00 00 00 00 00 00 00 00 00
960: 00 00 00 00 00 00 00 00 00 00 00 00 00 00 00 00
970: 00 00 00 00 00 00 00 00 00 00 00 00 00 00 00 00
980: 00 00 00 00 00 00 00 00 00 00 00 00 00 00 00 00
990: 00 00 00 00 00 00 00 00 00 00 00 00 00 00 00 00
9a0: 00 00 00 00 00 00 00 00 00 00 00 00 00 00 00 00
9b0: 00 00 00 00 00 00 00 00 00 00 00 00 00 00 00 00
9c0: 00 00 00 00 00 00 00 00 00 00 00 00 00 00 00 00
9d0: 00 00 00 00 00 00 00 00 00 00 00 00 00 00 00 00
9e0: 00 00 00 00 00 00 00 00 00 00 00 00 00 00 00 00
9f0: 00 00 00 00 00 00 00 00 00 00 00 00 00 00 00 00
a00: 00 00 00 00 00 00 00 00 00 00 00 00 00 00 00 00
a10: 00 00 00 00 00 00 00 00 00 00 00 00 00 00 00 00
a20: 00 00 00 00 00 00 00 00 00 00 00 00 00 00 00 00
a30: 00 00 00 00 00 00 00 00 00 00 00 00 00 00 00 00
a40: 00 00 00 00 00 00 00 00 00 00 00 00 00 00 00 00
a50: 00 00 00 00 00 00 00 00 00 00 00 00 00 00 00 00
a60: 00 00 00 00 00 00 00 00 00 00 00 00 00 00 00 00
a70: 00 00 00 00 00 00 00 00 00 00 00 00 00 00 00 00
a80: 00 00 00 00 00 00 00 00 00 00 00 00 00 00 00 00
a90: 00 00 00 00 00 00 00 00 00 00 00 00 00 00 00 00
aa0: 00 00 00 00 00 00 00 00 00 00 00 00 00 00 00 00
ab0: 00 00 00 00 00 00 00 00 00 00 00 00 00 00 00 00
ac0: 00 00 00 00 00 00 00 00 00 00 00 00 00 00 00 00
ad0: 00 00 00 00 00 00 00 00 00 00 00 00 00 00 00 00
ae0: 00 00 00 00 00 00 00 00 00 00 00 00 00 00 00 00
af0: 00 00 00 00 00 00 00 00 00 00 00 00 00 00 00 00
b00: 00 00 00 00 00 00 00 00 00 00 00 00 00 00 00 00
b10: 00 00 00 00 00 00 00 00 00 00 00 00 00 00 00 00
b20: 00 00 00 00 00 00 00 00 00 00 00 00 00 00 00 00
b30: 00 00 00 00 00 00 00 00 00 00 00 00 00 00 00 00
b40: 00 00 00 00 00 00 00 00 00 00 00 00 00 00 00 00
b50: 00 00 00 00 00 00 00 00 00 00 00 00 00 00 00 00
b60: 00 00 00 00 00 00 00 00 00 00 00 00 00 00 00 00
b70: 00 00 00 00 00 00 00 00 00 00 00 00 00 00 00 00
b80: 00 00 00 00 00 00 00 00 00 00 00 00 00 00 00 00
b90: 00 00 00 00 00 00 00 00 00 00 00 00 00 00 00 00
ba0: 00 00 00 00 00 00 00 00 00 00 00 00 00 00 00 00
bb0: 00 00 00 00 00 00 00 00 00 00 00 00 00 00 00 00
bc0: 00 00 00 00 00 00 00 00 00 00 00 00 00 00 00 00
bd0: 00 00 00 00 00 00 00 00 00 00 00 00 00 00 00 00
be0: 00 00 00 00 00 00 00 00 00 00 00 00 00 00 00 00
bf0: 00 00 00 00 00 00 00 00 00 00 00 00 00 00 00 00
c00: 00 00 00 00 00 00 00 00 00 00 00 00 00 00 00 00
c10: 00 00 00 00 00 00 00 00 00 00 00 00 00 00 00 00
c20: 00 00 00 00 00 00 00 00 00 00 00 00 00 00 00 00
c30: 00 00 00 00 00 00 00 00 00 00 00 00 00 00 00 00
c40: 00 00 00 00 00 00 00 00 00 00 00 00 00 00 00 00
c50: 00 00 00 00 00 00 00 00 00 00 00 00 00 00 00 00
c60: 00 00 00 00 00 00 00 00 00 00 00 00 00 00 00 00
c70: 00 00 00 00 00 00 00 00 00 00 00 00 00 00 00 00
c80: 00 00 00 00 00 00 00 00 00 00 00 00 00 00 00 00
c90: 00 00 00 00 00 00 00 00 00 00 00 00 00 00 00 00
ca0: 00 00 00 00 00 00 00 00 00 00 00 00 00 00 00 00
cb0: 00 00 00 00 00 00 00 00 00 00 00 00 00 00 00 00
cc0: 00 00 00 00 00 00 00 00 00 00 00 00 00 00 00 00
cd0: 00 00 00 00 00 00 00 00 00 00 00 00 00 00 00 00
ce0: 00 00 00 00 00 00 00 00 00 00 00 00 00 00 00 00
cf0: 00 00 00 00 00 00 00 00 00 00 00 00 00 00 00 00
d00: 00 00 00 00 00 00 00 00 00 00 00 00 00 00 00 00
d10: 00 00 00 00 00 00 00 00 00 00 00 00 00 00 00 00
d20: 00 00 00 00 00 00 00 00 00 00 00 00 00 00 00 00
d30: 00 00 00 00 00 00 00 00 00 00 00 00 00 00 00 00
d40: 00 00 00 00 00 00 00 00 00 00 00 00 00 00 00 00
d50: 00 00 00 00 00 00 00 00 00 00 00 00 00 00 00 00
d60: 00 00 00 00 00 00 00 00 00 00 00 00 00 00 00 00
d70: 00 00 00 00 00 00 00 00 00 00 00 00 00 00 00 00
d80: 00 00 00 00 00 00 00 00 00 00 00 00 00 00 00 00
d90: 00 00 00 00 00 00 00 00 00 00 00 00 00 00 00 00
da0: 00 00 00 00 00 00 00 00 00 00 00 00 00 00 00 00
db0: 00 00 00 00 00 00 00 00 00 00 00 00 00 00 00 00
dc0: 00 00 00 00 00 00 00 00 00 00 00 00 00 00 00 00
dd0: 00 00 00 00 00 00 00 00 00 00 00 00 00 00 00 00
de0: 00 00 00 00 00 00 00 00 00 00 00 00 00 00 00 00
df0: 00 00 00 00 00 00 00 00 00 00 00 00 00 00 00 00
e00: 00 00 00 00 00 00 00 00 00 00 00 00 00 00 00 00
e10: 00 00 00 00 00 00 00 00 00 00 00 00 00 00 00 00
e20: 00 00 00 00 00 00 00 00 00 00 00 00 00 00 00 00
e30: 00 00 00 00 00 00 00 00 00 00 00 00 00 00 00 00
e40: 00 00 00 00 00 00 00 00 00 00 00 00 00 00 00 00
e50: 00 00 00 00 00 00 00 00 00 00 00 00 00 00 00 00
e60: 00 00 00 00 00 00 00 00 00 00 00 00 00 00 00 00
e70: 00 00 00 00 00 00 00 00 00 00 00 00 00 00 00 00
e80: 00 00 00 00 00 00 00 00 00 00 00 00 00 00 00 00
e90: 00 00 00 00 00 00 00 00 00 00 00 00 00 00 00 00
ea0: 00 00 00 00 00 00 00 00 00 00 00 00 00 00 00 00
eb0: 00 00 00 00 00 00 00 00 00 00 00 00 00 00 00 00
ec0: 00 00 00 00 00 00 00 00 00 00 00 00 00 00 00 00
ed0: 00 00 00 00 00 00 00 00 00 00 00 00 00 00 00 00
ee0: 00 00 00 00 00 00 00 00 00 00 00 00 00 00 00 00
ef0: 00 00 00 00 00 00 00 00 00 00 00 00 00 00 00 00
f00: 00 00 00 00 00 00 00 00 00 00 00 00 00 00 00 00
f10: 00 00 00 00 00 00 00 00 00 00 00 00 00 00 00 00
f20: 00 00 00 00 00 00 00 00 00 00 00 00 00 00 00 00
f30: 00 00 00 00 00 00 00 00 00 00 00 00 00 00 00 00
f40: 00 00 00 00 00 00 00 00 00 00 00 00 00 00 00 00
f50: 00 00 00 00 00 00 00 00 00 00 00 00 00 00 00 00
f60: 00 00 00 00 00 00 00 00 00 00 00 00 00 00 00 00
f70: 00 00 00 00 00 00 00 00 00 00 00 00 00 00 00 00
f80: 00 00 00 00 00 00 00 00 00 00 00 00 00 00 00 00
f90: 00 00 00 00 00 00 00 00 00 00 00 00 00 00 00 00
fa0: 00 00 00 00 00 00 00 00 00 00 00 00 00 00 00 00
fb0: 00 00 00 00 00 00 00 00 00 00 00 00 00 00 00 00
fc0: 00 00 00 00 00 00 00 00 00 00 00 00 00 00 00 00
fd0: 00 00 00 00 00 00 00 00 00 00 00 00 00 00 00 00
fe0: 00 00 00 00 00 00 00 00 00 00 00 00 00 00 00 00
ff0: 00 00 00 00 00 00 00 00 00 00 00 00 00 00 00 00

00:1c.7 PCI bridge [0604]: Intel Corporation 7 Series/C210 Series Chipset Family PCI Express Root Port 8 [8086:1e1e] (rev c4) (prog-if 00 [Normal decode])
	Subsystem: Intel Corporation Device [8086:2034]
	Control: I/O+ Mem+ BusMaster+ SpecCycle- MemWINV- VGASnoop- ParErr- Stepping- SERR- FastB2B- DisINTx+
	Status: Cap+ 66MHz- UDF- FastB2B- ParErr- DEVSEL=fast >TAbort- <TAbort- <MAbort- >SERR- <PERR- INTx-
	Latency: 0, Cache Line Size: 64 bytes
	Interrupt: pin D routed to IRQ 25
	Bus: primary=00, secondary=02, subordinate=02, sec-latency=0
	I/O behind bridge: e000-efff [size=4K] [16-bit]
	Memory behind bridge: f7c00000-f7cfffff [size=1M] [32-bit]
	Prefetchable memory behind bridge: 00000000fff00000-00000000000fffff [disabled] [64-bit]
	Secondary status: 66MHz- FastB2B- ParErr- DEVSEL=fast >TAbort- <TAbort- <MAbort- <SERR- <PERR-
	BridgeCtl: Parity- SERR+ NoISA- VGA- VGA16+ MAbort- >Reset- FastB2B-
		PriDiscTmr- SecDiscTmr- DiscTmrStat- DiscTmrSERREn-
	Capabilities: [40] Express (v2) Root Port (Slot+), IntMsgNum 0
		DevCap:	MaxPayload 128 bytes, PhantFunc 0
			ExtTag- RBE+ TEE-IO-
		DevCtl:	CorrErr- NonFatalErr- FatalErr- UnsupReq-
			RlxdOrd- ExtTag- PhantFunc- AuxPwr- NoSnoop-
			MaxPayload 128 bytes, MaxReadReq 128 bytes
		DevSta:	CorrErr- NonFatalErr- FatalErr- UnsupReq- AuxPwr+ TransPend-
		LnkCap:	Port #8, Speed 5GT/s, Width x1, ASPM L0s L1, Exit Latency L0s <1us, L1 <16us
			ClockPM- Surprise- LLActRep+ BwNot- ASPMOptComp-
		LnkCtl:	ASPM Disabled; RCB 64 bytes, LnkDisable- CommClk-
			ExtSynch- ClockPM- AutWidDis- BWInt- AutBWInt-
		LnkSta:	Speed 2.5GT/s, Width x1
			TrErr- Train- SlotClk+ DLActive+ BWMgmt+ ABWMgmt-
		SltCap:	AttnBtn- PwrCtrl- MRL- AttnInd- PwrInd- HotPlug- Surprise-
			Slot #7, PowerLimit 10W; Interlock- NoCompl+
		SltCtl:	Enable: AttnBtn- PwrFlt- MRL- PresDet- CmdCplt- HPIrq- LinkChg-
			Control: AttnInd Unknown, PwrInd Unknown, Power- Interlock-
		SltSta:	Status: AttnBtn- PowerFlt- MRL- CmdCplt- PresDet+ Interlock-
			Changed: MRL- PresDet- LinkState-
		RootCap: CRSVisible-
		RootCtl: ErrCorrectable- ErrNon-Fatal- ErrFatal- PMEIntEna+ CRSVisible-
		RootSta: PME ReqID 0000, PMEStatus- PMEPending-
		DevCap2: Completion Timeout: Range BC, TimeoutDis+ NROPrPrP- LTR-
			 10BitTagComp- 10BitTagReq- OBFF Not Supported, ExtFmt- EETLPPrefix-
			 EmergencyPowerReduction Not Supported, EmergencyPowerReductionInit-
			 FRS- LN System CLS Not Supported, TPHComp- ExtTPHComp- ARIFwd-
			 AtomicOpsCap: Routing- 32bit- 64bit- 128bitCAS-
		DevCtl2: Completion Timeout: 50us to 50ms, TimeoutDis- ARIFwd-
			 AtomicOpsCtl: ReqEn- EgressBlck-
			 IDOReq- IDOCompl- LTR- EmergencyPowerReductionReq-
			 10BitTagReq- OBFF Disabled, EETLPPrefixBlk-
		LnkCtl2: Target Link Speed: 5GT/s, EnterCompliance- SpeedDis-
			 Transmit Margin: Normal Operating Range, EnterModifiedCompliance- ComplianceSOS-
			 Compliance Preset/De-emphasis: -6dB de-emphasis, 0dB preshoot
		LnkSta2: Current De-emphasis Level: -3.5dB, EqualizationComplete- EqualizationPhase1-
			 EqualizationPhase2- EqualizationPhase3- LinkEqualizationRequest-
			 Retimer- 2Retimers- CrosslinkRes: unsupported
	Capabilities: [80] MSI: Enable+ Count=1/1 Maskable- 64bit-
		Address: fee08004  Data: 0020
	Capabilities: [90] Subsystem: Intel Corporation Device [8086:2034]
	Capabilities: [a0] Power Management version 2
		Flags: PMEClk- DSI- D1- D2- AuxCurrent=0mA PME(D0+,D1-,D2-,D3hot+,D3cold+)
		Status: D0 NoSoftRst- PME-Enable- DSel=0 DScale=0 PME-
	Kernel driver in use: pcieport
00: 86 80 1e 1e 07 04 10 00 c4 00 04 06 10 00 81 00
10: 00 00 00 00 00 00 00 00 00 02 02 00 e0 e0 00 00
20: c0 f7 c0 f7 f1 ff 01 00 00 00 00 00 00 00 00 00
30: 00 00 00 00 40 00 00 00 00 00 00 00 0a 04 12 00
40: 10 80 42 01 00 80 00 00 00 00 10 00 12 4c 12 08
50: 00 00 11 70 00 b2 3c 00 00 00 40 00 08 00 00 00
60: 00 00 00 00 16 00 00 00 00 00 00 00 00 00 00 00
70: 02 00 01 00 00 00 00 00 00 00 00 00 00 00 00 00
80: 05 90 01 00 04 80 e0 fe 20 00 00 00 00 00 00 00
90: 0d a0 00 00 86 80 34 20 00 00 00 00 00 00 00 00
a0: 01 00 02 c8 00 00 00 00 00 00 00 00 00 00 00 00
b0: 00 00 00 00 00 00 00 00 00 00 00 00 00 00 00 00
c0: 00 00 00 00 00 00 00 00 00 00 00 00 00 00 00 00
d0: 00 00 00 01 02 0b 00 00 00 80 11 01 00 00 00 00
e0: 00 03 00 00 00 00 00 00 01 00 00 00 00 00 00 00
f0: 00 00 00 00 00 00 00 00 87 0f 04 08 00 00 00 00
100: 00 00 00 00 00 00 00 00 00 00 00 00 11 00 06 00
110: 00 00 00 00 00 20 00 00 00 00 00 00 00 00 00 00
120: 00 00 00 00 00 00 00 00 00 00 00 00 00 00 00 00
130: 00 00 00 00 00 00 00 00 00 00 00 00 00 00 00 00
140: 00 00 00 00 00 00 00 00 00 00 00 00 00 00 00 00
150: 00 00 00 00 00 00 00 00 00 00 00 00 00 00 00 00
160: 00 00 00 00 00 00 00 00 00 00 00 00 00 00 00 00
170: 00 00 00 00 00 00 00 00 00 00 00 00 00 00 00 00
180: 00 00 00 00 00 00 00 00 00 00 00 00 00 00 00 00
190: 00 00 00 00 00 00 00 00 00 00 00 00 00 00 00 00
1a0: 00 00 00 00 00 00 00 00 00 00 00 00 00 00 00 00
1b0: 00 00 00 00 00 00 00 00 00 00 00 00 00 00 00 00
1c0: 00 00 00 00 00 00 00 00 00 00 00 00 00 00 00 00
1d0: 00 00 00 00 00 00 00 00 00 00 00 00 00 00 00 00
1e0: 00 00 00 00 00 00 00 00 00 00 00 00 00 00 00 00
1f0: 00 00 00 00 00 00 00 00 00 00 00 00 00 00 00 00
200: 00 00 00 00 00 00 00 00 00 00 00 00 00 00 00 00
210: 00 00 00 00 00 00 00 00 00 00 00 00 00 00 00 00
220: 00 00 00 00 00 00 00 00 00 00 00 00 00 00 00 00
230: 00 00 00 00 00 00 00 00 00 00 00 00 00 00 00 00
240: 00 00 00 00 00 00 00 00 00 00 00 00 00 00 00 00
250: 00 00 00 00 00 00 00 00 00 00 00 00 00 00 00 00
260: 00 00 00 00 00 00 00 00 00 00 00 00 00 00 00 00
270: 00 00 00 00 00 00 00 00 00 00 00 00 00 00 00 00
280: 00 00 00 00 00 00 00 00 00 00 00 00 00 00 00 00
290: 00 00 00 00 00 00 00 00 00 00 00 00 00 00 00 00
2a0: 00 00 00 00 00 00 00 00 00 00 00 00 00 00 00 00
2b0: 00 00 00 00 00 00 00 00 00 00 00 00 00 00 00 00
2c0: 00 00 00 00 00 00 00 00 00 00 00 00 00 00 00 00
2d0: 00 00 00 00 00 00 00 00 00 00 00 00 00 00 00 00
2e0: 00 00 00 00 00 00 00 00 00 00 00 00 00 00 00 00
2f0: 00 00 00 00 00 00 00 00 00 00 00 00 00 00 00 00
300: 00 00 00 00 00 00 00 00 00 00 00 00 00 00 00 00
310: 00 00 00 00 1b 36 3a 74 00 00 14 14 31 17 42 00
320: 5b 60 09 00 20 20 00 0a 57 13 b8 04 56 03 1c 03
330: 16 00 00 28 bc b5 bc 4a 00 00 00 00 74 4c 85 00
340: 43 00 43 00 00 00 45 00 34 00 14 00 4d 00 12 00
350: 00 00 14 00 01 00 0a 00 02 00 02 00 00 00 00 00
360: 00 00 00 00 00 00 00 00 00 00 00 00 00 00 00 00
370: 00 00 00 00 00 00 00 00 00 00 00 00 00 00 00 00
380: 00 00 00 00 00 00 00 00 00 00 00 00 00 00 00 00
390: 00 00 00 00 00 00 00 00 00 00 00 00 00 00 00 00
3a0: 00 00 00 00 00 00 00 00 00 00 00 00 00 00 00 00
3b0: 00 00 00 00 00 00 00 00 00 00 00 00 00 00 00 00
3c0: 00 00 00 00 00 00 00 00 00 00 00 00 00 00 00 00
3d0: 00 00 00 00 00 00 00 00 00 00 00 00 00 00 00 00
3e0: 00 00 00 00 00 00 00 00 00 00 00 00 00 00 00 00
3f0: 00 00 00 00 00 00 00 00 00 00 00 00 00 00 00 00
400: 00 00 00 00 00 00 00 00 00 00 00 00 00 00 00 00
410: 00 00 00 00 00 00 00 00 00 00 00 00 00 00 00 00
420: 00 00 00 00 00 00 00 00 00 00 00 00 00 00 00 00
430: 00 00 00 00 00 00 00 00 00 00 00 00 00 00 00 00
440: 00 00 00 00 00 00 00 00 00 00 00 00 00 00 00 00
450: 00 00 00 00 00 00 00 00 00 00 00 00 00 00 00 00
460: 00 00 00 00 00 00 00 00 00 00 00 00 00 00 00 00
470: 00 00 00 00 00 00 00 00 00 00 00 00 00 00 00 00
480: 00 00 00 00 00 00 00 00 00 00 00 00 00 00 00 00
490: 00 00 00 00 00 00 00 00 00 00 00 00 00 00 00 00
4a0: 00 00 00 00 00 00 00 00 00 00 00 00 00 00 00 00
4b0: 00 00 00 00 00 00 00 00 00 00 00 00 00 00 00 00
4c0: 00 00 00 00 00 00 00 00 00 00 00 00 00 00 00 00
4d0: 00 00 00 00 00 00 00 00 00 00 00 00 00 00 00 00
4e0: 00 00 00 00 00 00 00 00 00 00 00 00 00 00 00 00
4f0: 00 00 00 00 00 00 00 00 00 00 00 00 00 00 00 00
500: 00 00 00 00 00 00 00 00 00 00 00 00 00 00 00 00
510: 00 00 00 00 00 00 00 00 00 00 00 00 00 00 00 00
520: 00 00 00 00 00 00 00 00 00 00 00 00 00 00 00 00
530: 00 00 00 00 00 00 00 00 00 00 00 00 00 00 00 00
540: 00 00 00 00 00 00 00 00 00 00 00 00 00 00 00 00
550: 00 00 00 00 00 00 00 00 00 00 00 00 00 00 00 00
560: 00 00 00 00 00 00 00 00 00 00 00 00 00 00 00 00
570: 00 00 00 00 00 00 00 00 00 00 00 00 00 00 00 00
580: 00 00 00 00 00 00 00 00 00 00 00 00 00 00 00 00
590: 00 00 00 00 00 00 00 00 00 00 00 00 00 00 00 00
5a0: 00 00 00 00 00 00 00 00 00 00 00 00 00 00 00 00
5b0: 00 00 00 00 00 00 00 00 00 00 00 00 00 00 00 00
5c0: 00 00 00 00 00 00 00 00 00 00 00 00 00 00 00 00
5d0: 00 00 00 00 00 00 00 00 00 00 00 00 00 00 00 00
5e0: 00 00 00 00 00 00 00 00 00 00 00 00 00 00 00 00
5f0: 00 00 00 00 00 00 00 00 00 00 00 00 00 00 00 00
600: 00 00 00 00 00 00 00 00 00 00 00 00 00 00 00 00
610: 00 00 00 00 00 00 00 00 00 00 00 00 00 00 00 00
620: 00 00 00 00 00 00 00 00 00 00 00 00 00 00 00 00
630: 00 00 00 00 00 00 00 00 00 00 00 00 00 00 00 00
640: 00 00 00 00 00 00 00 00 00 00 00 00 00 00 00 00
650: 00 00 00 00 00 00 00 00 00 00 00 00 00 00 00 00
660: 00 00 00 00 00 00 00 00 00 00 00 00 00 00 00 00
670: 00 00 00 00 00 00 00 00 00 00 00 00 00 00 00 00
680: 00 00 00 00 00 00 00 00 00 00 00 00 00 00 00 00
690: 00 00 00 00 00 00 00 00 00 00 00 00 00 00 00 00
6a0: 00 00 00 00 00 00 00 00 00 00 00 00 00 00 00 00
6b0: 00 00 00 00 00 00 00 00 00 00 00 00 00 00 00 00
6c0: 00 00 00 00 00 00 00 00 00 00 00 00 00 00 00 00
6d0: 00 00 00 00 00 00 00 00 00 00 00 00 00 00 00 00
6e0: 00 00 00 00 00 00 00 00 00 00 00 00 00 00 00 00
6f0: 00 00 00 00 00 00 00 00 00 00 00 00 00 00 00 00
700: 00 00 00 00 00 00 00 00 00 00 00 00 00 00 00 00
710: 00 00 00 00 00 00 00 00 00 00 00 00 00 00 00 00
720: 00 00 00 00 00 00 00 00 00 00 00 00 00 00 00 00
730: 00 00 00 00 00 00 00 00 00 00 00 00 00 00 00 00
740: 00 00 00 00 00 00 00 00 00 00 00 00 00 00 00 00
750: 00 00 00 00 00 00 00 00 00 00 00 00 00 00 00 00
760: 00 00 00 00 00 00 00 00 00 00 00 00 00 00 00 00
770: 00 00 00 00 00 00 00 00 00 00 00 00 00 00 00 00
780: 00 00 00 00 00 00 00 00 00 00 00 00 00 00 00 00
790: 00 00 00 00 00 00 00 00 00 00 00 00 00 00 00 00
7a0: 00 00 00 00 00 00 00 00 00 00 00 00 00 00 00 00
7b0: 00 00 00 00 00 00 00 00 00 00 00 00 00 00 00 00
7c0: 00 00 00 00 00 00 00 00 00 00 00 00 00 00 00 00
7d0: 00 00 00 00 00 00 00 00 00 00 00 00 00 00 00 00
7e0: 00 00 00 00 00 00 00 00 00 00 00 00 00 00 00 00
7f0: 00 00 00 00 00 00 00 00 00 00 00 00 00 00 00 00
800: 00 00 00 00 00 00 00 00 00 00 00 00 00 00 00 00
810: 00 00 00 00 00 00 00 00 00 00 00 00 00 00 00 00
820: 00 00 00 00 00 00 00 00 00 00 00 00 00 00 00 00
830: 00 00 00 00 00 00 00 00 00 00 00 00 00 00 00 00
840: 00 00 00 00 00 00 00 00 00 00 00 00 00 00 00 00
850: 00 00 00 00 00 00 00 00 00 00 00 00 00 00 00 00
860: 00 00 00 00 00 00 00 00 00 00 00 00 00 00 00 00
870: 00 00 00 00 00 00 00 00 00 00 00 00 00 00 00 00
880: 00 00 00 00 00 00 00 00 00 00 00 00 00 00 00 00
890: 00 00 00 00 00 00 00 00 00 00 00 00 00 00 00 00
8a0: 00 00 00 00 00 00 00 00 00 00 00 00 00 00 00 00
8b0: 00 00 00 00 00 00 00 00 00 00 00 00 00 00 00 00
8c0: 00 00 00 00 00 00 00 00 00 00 00 00 00 00 00 00
8d0: 00 00 00 00 00 00 00 00 00 00 00 00 00 00 00 00
8e0: 00 00 00 00 00 00 00 00 00 00 00 00 00 00 00 00
8f0: 00 00 00 00 00 00 00 00 00 00 00 00 00 00 00 00
900: 00 00 00 00 00 00 00 00 00 00 00 00 00 00 00 00
910: 00 00 00 00 00 00 00 00 00 00 00 00 00 00 00 00
920: 00 00 00 00 00 00 00 00 00 00 00 00 00 00 00 00
930: 00 00 00 00 00 00 00 00 00 00 00 00 00 00 00 00
940: 00 00 00 00 00 00 00 00 00 00 00 00 00 00 00 00
950: 00 00 00 00 00 00 00 00 00 00 00 00 00 00 00 00
960: 00 00 00 00 00 00 00 00 00 00 00 00 00 00 00 00
970: 00 00 00 00 00 00 00 00 00 00 00 00 00 00 00 00
980: 00 00 00 00 00 00 00 00 00 00 00 00 00 00 00 00
990: 00 00 00 00 00 00 00 00 00 00 00 00 00 00 00 00
9a0: 00 00 00 00 00 00 00 00 00 00 00 00 00 00 00 00
9b0: 00 00 00 00 00 00 00 00 00 00 00 00 00 00 00 00
9c0: 00 00 00 00 00 00 00 00 00 00 00 00 00 00 00 00
9d0: 00 00 00 00 00 00 00 00 00 00 00 00 00 00 00 00
9e0: 00 00 00 00 00 00 00 00 00 00 00 00 00 00 00 00
9f0: 00 00 00 00 00 00 00 00 00 00 00 00 00 00 00 00
a00: 00 00 00 00 00 00 00 00 00 00 00 00 00 00 00 00
a10: 00 00 00 00 00 00 00 00 00 00 00 00 00 00 00 00
a20: 00 00 00 00 00 00 00 00 00 00 00 00 00 00 00 00
a30: 00 00 00 00 00 00 00 00 00 00 00 00 00 00 00 00
a40: 00 00 00 00 00 00 00 00 00 00 00 00 00 00 00 00
a50: 00 00 00 00 00 00 00 00 00 00 00 00 00 00 00 00
a60: 00 00 00 00 00 00 00 00 00 00 00 00 00 00 00 00
a70: 00 00 00 00 00 00 00 00 00 00 00 00 00 00 00 00
a80: 00 00 00 00 00 00 00 00 00 00 00 00 00 00 00 00
a90: 00 00 00 00 00 00 00 00 00 00 00 00 00 00 00 00
aa0: 00 00 00 00 00 00 00 00 00 00 00 00 00 00 00 00
ab0: 00 00 00 00 00 00 00 00 00 00 00 00 00 00 00 00
ac0: 00 00 00 00 00 00 00 00 00 00 00 00 00 00 00 00
ad0: 00 00 00 00 00 00 00 00 00 00 00 00 00 00 00 00
ae0: 00 00 00 00 00 00 00 00 00 00 00 00 00 00 00 00
af0: 00 00 00 00 00 00 00 00 00 00 00 00 00 00 00 00
b00: 00 00 00 00 00 00 00 00 00 00 00 00 00 00 00 00
b10: 00 00 00 00 00 00 00 00 00 00 00 00 00 00 00 00
b20: 00 00 00 00 00 00 00 00 00 00 00 00 00 00 00 00
b30: 00 00 00 00 00 00 00 00 00 00 00 00 00 00 00 00
b40: 00 00 00 00 00 00 00 00 00 00 00 00 00 00 00 00
b50: 00 00 00 00 00 00 00 00 00 00 00 00 00 00 00 00
b60: 00 00 00 00 00 00 00 00 00 00 00 00 00 00 00 00
b70: 00 00 00 00 00 00 00 00 00 00 00 00 00 00 00 00
b80: 00 00 00 00 00 00 00 00 00 00 00 00 00 00 00 00
b90: 00 00 00 00 00 00 00 00 00 00 00 00 00 00 00 00
ba0: 00 00 00 00 00 00 00 00 00 00 00 00 00 00 00 00
bb0: 00 00 00 00 00 00 00 00 00 00 00 00 00 00 00 00
bc0: 00 00 00 00 00 00 00 00 00 00 00 00 00 00 00 00
bd0: 00 00 00 00 00 00 00 00 00 00 00 00 00 00 00 00
be0: 00 00 00 00 00 00 00 00 00 00 00 00 00 00 00 00
bf0: 00 00 00 00 00 00 00 00 00 00 00 00 00 00 00 00
c00: 00 00 00 00 00 00 00 00 00 00 00 00 00 00 00 00
c10: 00 00 00 00 00 00 00 00 00 00 00 00 00 00 00 00
c20: 00 00 00 00 00 00 00 00 00 00 00 00 00 00 00 00
c30: 00 00 00 00 00 00 00 00 00 00 00 00 00 00 00 00
c40: 00 00 00 00 00 00 00 00 00 00 00 00 00 00 00 00
c50: 00 00 00 00 00 00 00 00 00 00 00 00 00 00 00 00
c60: 00 00 00 00 00 00 00 00 00 00 00 00 00 00 00 00
c70: 00 00 00 00 00 00 00 00 00 00 00 00 00 00 00 00
c80: 00 00 00 00 00 00 00 00 00 00 00 00 00 00 00 00
c90: 00 00 00 00 00 00 00 00 00 00 00 00 00 00 00 00
ca0: 00 00 00 00 00 00 00 00 00 00 00 00 00 00 00 00
cb0: 00 00 00 00 00 00 00 00 00 00 00 00 00 00 00 00
cc0: 00 00 00 00 00 00 00 00 00 00 00 00 00 00 00 00
cd0: 00 00 00 00 00 00 00 00 00 00 00 00 00 00 00 00
ce0: 00 00 00 00 00 00 00 00 00 00 00 00 00 00 00 00
cf0: 00 00 00 00 00 00 00 00 00 00 00 00 00 00 00 00
d00: 00 00 00 00 00 00 00 00 00 00 00 00 00 00 00 00
d10: 00 00 00 00 00 00 00 00 00 00 00 00 00 00 00 00
d20: 00 00 00 00 00 00 00 00 00 00 00 00 00 00 00 00
d30: 00 00 00 00 00 00 00 00 00 00 00 00 00 00 00 00
d40: 00 00 00 00 00 00 00 00 00 00 00 00 00 00 00 00
d50: 00 00 00 00 00 00 00 00 00 00 00 00 00 00 00 00
d60: 00 00 00 00 00 00 00 00 00 00 00 00 00 00 00 00
d70: 00 00 00 00 00 00 00 00 00 00 00 00 00 00 00 00
d80: 00 00 00 00 00 00 00 00 00 00 00 00 00 00 00 00
d90: 00 00 00 00 00 00 00 00 00 00 00 00 00 00 00 00
da0: 00 00 00 00 00 00 00 00 00 00 00 00 00 00 00 00
db0: 00 00 00 00 00 00 00 00 00 00 00 00 00 00 00 00
dc0: 00 00 00 00 00 00 00 00 00 00 00 00 00 00 00 00
dd0: 00 00 00 00 00 00 00 00 00 00 00 00 00 00 00 00
de0: 00 00 00 00 00 00 00 00 00 00 00 00 00 00 00 00
df0: 00 00 00 00 00 00 00 00 00 00 00 00 00 00 00 00
e00: 00 00 00 00 00 00 00 00 00 00 00 00 00 00 00 00
e10: 00 00 00 00 00 00 00 00 00 00 00 00 00 00 00 00
e20: 00 00 00 00 00 00 00 00 00 00 00 00 00 00 00 00
e30: 00 00 00 00 00 00 00 00 00 00 00 00 00 00 00 00
e40: 00 00 00 00 00 00 00 00 00 00 00 00 00 00 00 00
e50: 00 00 00 00 00 00 00 00 00 00 00 00 00 00 00 00
e60: 00 00 00 00 00 00 00 00 00 00 00 00 00 00 00 00
e70: 00 00 00 00 00 00 00 00 00 00 00 00 00 00 00 00
e80: 00 00 00 00 00 00 00 00 00 00 00 00 00 00 00 00
e90: 00 00 00 00 00 00 00 00 00 00 00 00 00 00 00 00
ea0: 00 00 00 00 00 00 00 00 00 00 00 00 00 00 00 00
eb0: 00 00 00 00 00 00 00 00 00 00 00 00 00 00 00 00
ec0: 00 00 00 00 00 00 00 00 00 00 00 00 00 00 00 00
ed0: 00 00 00 00 00 00 00 00 00 00 00 00 00 00 00 00
ee0: 00 00 00 00 00 00 00 00 00 00 00 00 00 00 00 00
ef0: 00 00 00 00 00 00 00 00 00 00 00 00 00 00 00 00
f00: 00 00 00 00 00 00 00 00 00 00 00 00 00 00 00 00
f10: 00 00 00 00 00 00 00 00 00 00 00 00 00 00 00 00
f20: 00 00 00 00 00 00 00 00 00 00 00 00 00 00 00 00
f30: 00 00 00 00 00 00 00 00 00 00 00 00 00 00 00 00
f40: 00 00 00 00 00 00 00 00 00 00 00 00 00 00 00 00
f50: 00 00 00 00 00 00 00 00 00 00 00 00 00 00 00 00
f60: 00 00 00 00 00 00 00 00 00 00 00 00 00 00 00 00
f70: 00 00 00 00 00 00 00 00 00 00 00 00 00 00 00 00
f80: 00 00 00 00 00 00 00 00 00 00 00 00 00 00 00 00
f90: 00 00 00 00 00 00 00 00 00 00 00 00 00 00 00 00
fa0: 00 00 00 00 00 00 00 00 00 00 00 00 00 00 00 00
fb0: 00 00 00 00 00 00 00 00 00 00 00 00 00 00 00 00
fc0: 00 00 00 00 00 00 00 00 00 00 00 00 00 00 00 00
fd0: 00 00 00 00 00 00 00 00 00 00 00 00 00 00 00 00
fe0: 00 00 00 00 00 00 00 00 00 00 00 00 00 00 00 00
ff0: 00 00 00 00 00 00 00 00 00 00 00 00 00 00 00 00

00:1d.0 USB controller [0c03]: Intel Corporation 7 Series/C216 Chipset Family USB Enhanced Host Controller #1 [8086:1e26] (rev 04) (prog-if 20 [EHCI])
	Subsystem: Intel Corporation Device [8086:2034]
	Control: I/O- Mem+ BusMaster+ SpecCycle- MemWINV- VGASnoop- ParErr- Stepping- SERR- FastB2B- DisINTx-
	Status: Cap+ 66MHz- UDF- FastB2B+ ParErr- DEVSEL=medium >TAbort- <TAbort- <MAbort- >SERR- <PERR- INTx-
	Latency: 0
	Interrupt: pin A routed to IRQ 23
	Region 0: Memory at f7d37000 (32-bit, non-prefetchable) [size=1K]
	Capabilities: [50] Power Management version 2
		Flags: PMEClk- DSI- D1- D2- AuxCurrent=375mA PME(D0+,D1-,D2-,D3hot+,D3cold+)
		Status: D0 NoSoftRst- PME-Enable- DSel=0 DScale=0 PME-
	Capabilities: [58] Debug port: BAR=1 offset=00a0
	Capabilities: [98] PCI Advanced Features
		AFCap: TP+ FLR+
		AFCtrl: FLR-
		AFStatus: TP-
	Kernel driver in use: ehci-pci
00: 86 80 26 1e 06 00 90 02 04 20 03 0c 00 00 00 00
10: 00 70 d3 f7 00 00 00 00 00 00 00 00 00 00 00 00
20: 00 00 00 00 00 00 00 00 00 00 00 00 86 80 34 20
30: 00 00 00 00 50 00 00 00 00 00 00 00 04 01 00 00
40: 00 00 00 00 00 00 00 00 00 00 00 00 00 00 00 00
50: 01 58 c2 c9 00 00 00 00 0a 98 a0 20 00 00 00 00
60: 20 20 ff 07 00 00 00 00 01 00 00 01 00 00 00 40
70: 00 00 df 3f 00 00 00 00 00 00 00 00 00 00 00 00
80: 00 00 80 00 11 88 0c 93 30 0d 00 24 00 00 00 00
90: 00 00 00 00 00 00 00 00 13 00 06 03 00 00 00 00
a0: 00 00 00 00 00 00 00 00 00 00 00 00 00 00 00 00
b0: 00 00 00 00 00 00 00 00 00 00 00 00 00 00 00 00
c0: 00 00 00 00 00 00 00 00 00 00 00 00 00 00 00 00
d0: 00 00 00 00 00 aa ff 00 00 00 00 00 00 00 00 00
e0: 00 00 00 00 08 02 40 60 05 42 10 34 04 c0 70 da
f0: 00 00 00 00 88 85 80 00 87 0f 04 08 08 17 5b 20

00:1f.0 ISA bridge [0601]: Intel Corporation H77 Express Chipset LPC Controller [8086:1e4a] (rev 04)
	Subsystem: Intel Corporation Device [8086:2034]
	Control: I/O+ Mem+ BusMaster+ SpecCycle- MemWINV- VGASnoop- ParErr- Stepping- SERR- FastB2B- DisINTx-
	Status: Cap+ 66MHz- UDF- FastB2B- ParErr- DEVSEL=medium >TAbort- <TAbort- <MAbort- >SERR- <PERR- INTx-
	Latency: 0
	Capabilities: [e0] Vendor Specific Information: Len=0c <?>
	Kernel driver in use: lpc_ich
	Kernel modules: lpc_ich
00: 86 80 4a 1e 07 00 10 02 04 00 01 06 00 00 80 00
10: 00 00 00 00 00 00 00 00 00 00 00 00 00 00 00 00
20: 00 00 00 00 00 00 00 00 00 00 00 00 86 80 34 20
30: 00 00 00 00 e0 00 00 00 00 00 00 00 00 00 00 00
40: 01 04 00 00 80 00 00 00 01 05 00 00 11 00 00 00
50: f8 00 00 00 00 00 00 00 00 00 00 00 00 00 00 00
60: 8b 80 8b 8a 90 00 00 00 85 80 83 84 f8 f0 00 00
70: 78 f0 78 f0 78 f0 78 f0 78 f0 78 f0 78 f0 78 f0
80: 00 00 00 14 01 0a fc 00 00 00 00 00 00 00 00 00
90: 00 00 00 00 00 0f 00 00 00 00 00 00 00 00 00 00
a0: 18 0e a0 00 09 39 06 00 00 47 00 00 00 00 01 80
b0: 00 00 00 00 00 00 00 00 00 00 00 00 00 00 00 00
c0: 00 00 00 00 00 00 00 00 00 00 00 00 00 00 00 00
d0: 33 22 11 00 67 45 00 00 cf ff 00 00 0a 00 00 00
e0: 09 00 0c 10 00 00 00 00 b3 02 64 04 00 00 00 00
f0: 01 c0 d1 fe 00 00 00 00 87 0f 04 08 00 00 00 00

00:1f.2 SATA controller [0106]: Intel Corporation 7 Series/C210 Series Chipset Family 6-port SATA Controller [AHCI mode] [8086:1e02] (rev 04) (prog-if 01 [AHCI 1.0])
	Subsystem: Intel Corporation Device [8086:2034]
	Control: I/O+ Mem+ BusMaster+ SpecCycle- MemWINV- VGASnoop- ParErr- Stepping- SERR- FastB2B- DisINTx+
	Status: Cap+ 66MHz+ UDF- FastB2B+ ParErr- DEVSEL=medium >TAbort- <TAbort- <MAbort- >SERR- <PERR- INTx-
	Latency: 0
	Interrupt: pin B routed to IRQ 26
	Region 0: I/O ports at f0d0 [size=8]
	Region 1: I/O ports at f0c0 [size=4]
	Region 2: I/O ports at f0b0 [size=8]
	Region 3: I/O ports at f0a0 [size=4]
	Region 4: I/O ports at f060 [size=32]
	Region 5: Memory at f7d36000 (32-bit, non-prefetchable) [size=2K]
	Capabilities: [80] MSI: Enable+ Count=1/1 Maskable- 64bit-
		Address: fee01004  Data: 0020
	Capabilities: [70] Power Management version 3
		Flags: PMEClk- DSI- D1- D2- AuxCurrent=0mA PME(D0-,D1-,D2-,D3hot+,D3cold-)
		Status: D0 NoSoftRst+ PME-Enable- DSel=0 DScale=0 PME-
	Capabilities: [a8] SATA HBA v1.0 BAR4 Offset=00000004
	Capabilities: [b0] PCI Advanced Features
		AFCap: TP+ FLR+
		AFCtrl: FLR-
		AFStatus: TP-
	Kernel driver in use: ahci
00: 86 80 02 1e 07 04 b0 02 04 01 06 01 00 00 00 00
10: d1 f0 00 00 c1 f0 00 00 b1 f0 00 00 a1 f0 00 00
20: 61 f0 00 00 00 60 d3 f7 00 00 00 00 86 80 34 20
30: 00 00 00 00 80 00 00 00 00 00 00 00 0a 02 00 00
40: 00 80 00 80 00 00 00 00 00 00 00 00 00 00 00 00
50: 00 00 00 00 00 00 00 00 00 00 00 00 00 00 00 00
60: 00 00 00 00 00 00 00 00 00 00 00 00 00 00 00 00
70: 01 a8 03 40 08 00 00 00 00 00 00 00 00 00 00 00
80: 05 70 01 00 04 10 e0 fe 20 00 00 00 00 00 00 00
90: 60 0f 30 90 83 01 00 0f 08 42 5c 01 00 00 00 00
a0: e0 00 00 00 00 00 00 00 12 b0 10 00 48 00 00 00
b0: 13 00 06 03 00 00 00 00 00 00 00 00 00 00 00 00
c0: 00 00 00 00 00 00 00 00 00 00 00 00 00 00 00 00
d0: 00 00 00 00 00 00 00 00 00 00 00 00 00 00 00 00
e0: 00 00 00 00 00 00 00 00 00 00 00 00 00 00 00 00
f0: 00 00 00 00 00 00 00 00 87 0f 04 08 00 00 00 00

00:1f.3 SMBus [0c05]: Intel Corporation 7 Series/C216 Chipset Family SMBus Controller [8086:1e22] (rev 04)
	Subsystem: Intel Corporation Device [8086:2034]
	Control: I/O+ Mem+ BusMaster- SpecCycle- MemWINV- VGASnoop- ParErr- Stepping- SERR- FastB2B- DisINTx-
	Status: Cap- 66MHz- UDF- FastB2B+ ParErr- DEVSEL=medium >TAbort- <TAbort- <MAbort- >SERR- <PERR- INTx-
	Interrupt: pin C routed to IRQ 18
	Region 0: Memory at f7d35000 (64-bit, non-prefetchable) [size=256]
	Region 4: I/O ports at f040 [size=32]
	Kernel driver in use: i801_smbus
	Kernel modules: i2c_i801
00: 86 80 22 1e 03 00 80 02 04 00 05 0c 00 00 00 00
10: 04 50 d3 f7 00 00 00 00 00 00 00 00 00 00 00 00
20: 41 f0 00 00 00 00 00 00 00 00 00 00 86 80 34 20
30: 00 00 00 00 00 00 00 00 00 00 00 00 0b 03 00 00
40: 01 00 00 00 00 00 00 00 00 00 00 00 00 00 00 00
50: 00 00 00 00 00 00 00 00 00 00 00 00 00 00 00 00
60: 03 04 04 00 00 00 08 08 00 00 00 00 00 00 00 00
70: 00 00 00 00 00 00 00 00 00 00 00 00 00 00 00 00
80: 04 00 00 00 00 00 00 00 00 00 00 00 00 00 00 00
90: 00 00 00 00 00 00 00 00 00 00 00 00 00 00 00 00
a0: 00 00 00 00 00 00 00 00 00 00 00 00 00 00 00 00
b0: 00 00 00 00 00 00 00 00 00 00 00 00 00 00 00 00
c0: 00 00 00 00 00 00 00 00 00 00 00 00 00 00 00 00
d0: 00 00 00 00 00 00 00 00 00 00 00 00 00 00 00 00
e0: 00 00 00 00 00 00 00 00 00 00 00 00 00 00 00 00
f0: 00 00 00 00 00 00 00 00 87 0f 04 08 00 00 00 00

02:00.0 FireWire (IEEE 1394) [0c00]: VIA Technologies, Inc. VT6315 Series Firewire Controller [1106:3403] (rev 01) (prog-if 10 [OHCI])
	Subsystem: Intel Corporation Device [8086:2034]
	Control: I/O+ Mem+ BusMaster+ SpecCycle- MemWINV- VGASnoop- ParErr- Stepping- SERR+ FastB2B- DisINTx-
	Status: Cap+ 66MHz- UDF- FastB2B- ParErr- DEVSEL=fast >TAbort- <TAbort- <MAbort- >SERR- <PERR- INTx-
	Latency: 0, Cache Line Size: 32 bytes
	Interrupt: pin A routed to IRQ 19
	Region 0: Memory at f7c00000 (64-bit, non-prefetchable) [size=2K]
	Region 2: I/O ports at e000 [size=256]
	Capabilities: [50] Power Management version 3
		Flags: PMEClk- DSI- D1- D2+ AuxCurrent=0mA PME(D0-,D1-,D2+,D3hot+,D3cold+)
		Status: D0 NoSoftRst- PME-Enable- DSel=0 DScale=0 PME-
	Capabilities: [80] MSI: Enable- Count=1/1 Maskable+ 64bit+
		Address: 0000000000000000  Data: 0000
		Masking: 00000000  Pending: 00000000
	Capabilities: [98] Express (v1) Endpoint, IntMsgNum 0
		DevCap:	MaxPayload 128 bytes, PhantFunc 0, Latency L0s <64ns, L1 <1us
			ExtTag- AttnBtn- AttnInd- PwrInd- RBE+ FLReset- SlotPowerLimit 10W TEE-IO-
		DevCtl:	CorrErr+ NonFatalErr+ FatalErr+ UnsupReq+
			RlxdOrd- ExtTag- PhantFunc- AuxPwr- NoSnoop-
			MaxPayload 128 bytes, MaxReadReq 512 bytes
		DevSta:	CorrErr- NonFatalErr- FatalErr- UnsupReq- AuxPwr+ TransPend-
		LnkCap:	Port #0, Speed 2.5GT/s, Width x1, ASPM L0s L1, Exit Latency L0s <1us, L1 <64us
			ClockPM+ Surprise- LLActRep- BwNot- ASPMOptComp-
		LnkCtl:	ASPM Disabled; RCB 64 bytes, LnkDisable- CommClk-
			ExtSynch- ClockPM- AutWidDis- BWInt- AutBWInt-
		LnkSta:	Speed 2.5GT/s, Width x1
			TrErr- Train- SlotClk- DLActive- BWMgmt- ABWMgmt-
	Capabilities: [100 v1] Advanced Error Reporting
		UESta:	DLP- SDES- TLP- FCP- CmpltTO- CmpltAbrt- UnxCmplt- RxOF- MalfTLP- ECRC- UnsupReq- ACSViol-
		UEMsk:	DLP- SDES- TLP- FCP- CmpltTO- CmpltAbrt- UnxCmplt- RxOF- MalfTLP- ECRC- UnsupReq- ACSViol-
		UESvrt:	DLP+ SDES+ TLP- FCP+ CmpltTO- CmpltAbrt- UnxCmplt- RxOF+ MalfTLP+ ECRC- UnsupReq- ACSViol-
		CESta:	RxErr- BadTLP- BadDLLP- Rollover- Timeout- AdvNonFatalErr-
		CEMsk:	RxErr- BadTLP- BadDLLP- Rollover- Timeout- AdvNonFatalErr+
		AERCap:	First Error Pointer: 14, ECRCGenCap+ ECRCGenEn- ECRCChkCap+ ECRCChkEn-
			MultHdrRecCap- MultHdrRecEn- TLPPfxPres- HdrLogCap-
		HeaderLog: 00000000 00000000 00000000 00000000
	Capabilities: [130 v1] Device Serial Number 00-40-63-ff-ff-00-00-00
	Kernel driver in use: firewire_ohci
	Kernel modules: firewire_ohci
00: 06 11 03 34 07 01 10 00 01 10 00 0c 08 00 00 00
10: 04 00 c0 f7 00 00 00 00 01 e0 00 00 00 00 00 00
20: 00 00 00 00 00 00 00 00 00 00 00 00 86 80 34 20
30: 00 00 00 00 50 00 00 00 00 00 00 00 0a 01 00 00
40: 00 00 00 00 00 00 00 00 00 00 00 00 00 00 00 00
50: 01 80 03 e4 00 00 00 00 00 00 00 00 00 00 00 00
60: 00 00 00 00 02 00 00 00 00 00 00 00 00 00 00 00
70: 00 00 00 00 00 00 00 00 00 00 00 00 00 00 00 00
80: 05 98 80 01 00 00 00 00 00 00 00 00 00 00 00 00
90: 00 00 00 00 00 00 00 00 10 00 01 00 00 80 90 05
a0: 0f 20 10 00 11 4c 07 00 00 00 11 00 00 00 00 00
b0: 00 00 00 00 00 00 00 00 00 00 00 00 00 00 00 00
c0: 00 00 00 00 00 00 00 00 00 00 00 00 00 00 00 00
d0: 00 00 00 00 00 00 00 00 00 00 00 00 00 00 00 00
e0: 00 00 00 00 00 00 00 00 00 00 00 00 00 00 00 00
f0: 00 00 00 00 00 00 00 00 00 00 00 00 00 00 00 00
100: 01 00 01 13 00 00 00 00 00 00 00 00 30 20 06 00
110: 00 00 00 00 00 20 00 00 b4 00 00 00 00 00 00 00
120: 00 00 00 00 00 00 00 00 00 00 00 00 00 00 00 00
130: 03 00 01 00 00 00 00 ff ff 63 40 00 00 00 00 00
140: 00 00 00 00 00 00 00 00 00 00 00 00 00 00 00 00
150: 00 00 00 00 00 00 00 00 00 00 00 00 00 00 00 00
160: 00 00 00 00 00 00 00 00 00 00 00 00 00 00 00 00
170: 00 00 00 00 00 00 00 00 00 00 00 00 00 00 00 00
180: 00 00 00 00 00 00 00 00 00 00 00 00 00 00 00 00
190: 00 00 00 00 00 00 00 00 00 00 00 00 00 00 00 00
1a0: 00 00 00 00 00 00 00 00 00 00 00 00 00 00 00 00
1b0: 00 00 00 00 00 00 00 00 00 00 00 00 00 00 00 00
1c0: 00 00 00 00 00 00 00 00 00 00 00 00 00 00 00 00
1d0: 00 00 00 00 00 00 00 00 00 00 00 00 00 00 00 00
1e0: 00 00 00 00 00 00 00 00 00 00 00 00 00 00 00 00
1f0: 00 00 00 00 00 00 00 00 00 00 00 00 00 00 00 00
200: 00 00 00 00 00 00 00 00 00 00 00 00 00 00 00 00
210: 00 00 00 00 00 00 00 00 00 00 00 00 00 00 00 00
220: 00 00 00 00 00 00 00 00 00 00 00 00 00 00 00 00
230: 00 00 00 00 00 00 00 00 00 00 00 00 00 00 00 00
240: 00 00 00 00 00 00 00 00 00 00 00 00 00 00 00 00
250: 00 00 00 00 00 00 00 00 00 00 00 00 00 00 00 00
260: 00 00 00 00 00 00 00 00 00 00 00 00 00 00 00 00
270: 00 00 00 00 00 00 00 00 00 00 00 00 00 00 00 00
280: 00 00 00 00 00 00 00 00 00 00 00 00 00 00 00 00
290: 00 00 00 00 00 00 00 00 00 00 00 00 00 00 00 00
2a0: 00 00 00 00 00 00 00 00 00 00 00 00 00 00 00 00
2b0: 00 00 00 00 00 00 00 00 00 00 00 00 00 00 00 00
2c0: 00 00 00 00 00 00 00 00 00 00 00 00 00 00 00 00
2d0: 00 00 00 00 00 00 00 00 00 00 00 00 00 00 00 00
2e0: 00 00 00 00 00 00 00 00 00 00 00 00 00 00 00 00
2f0: 00 00 00 00 00 00 00 00 00 00 00 00 00 00 00 00
300: 00 00 00 00 00 00 00 00 00 00 00 00 00 00 00 00
310: 00 00 00 00 00 00 00 00 00 00 00 00 00 00 00 00
320: 00 00 00 00 00 00 00 00 00 00 00 00 00 00 00 00
330: 00 00 00 00 00 00 00 00 00 00 00 00 00 00 00 00
340: 00 00 00 00 00 00 00 00 00 00 00 00 00 00 00 00
350: 00 00 00 00 00 00 00 00 00 00 00 00 00 00 00 00
360: 00 00 00 00 00 00 00 00 00 00 00 00 00 00 00 00
370: 00 00 00 00 00 00 00 00 00 00 00 00 00 00 00 00
380: 00 00 00 00 00 00 00 00 00 00 00 00 00 00 00 00
390: 00 00 00 00 00 00 00 00 00 00 00 00 00 00 00 00
3a0: 00 00 00 00 00 00 00 00 00 00 00 00 00 00 00 00
3b0: 00 00 00 00 00 00 00 00 00 00 00 00 00 00 00 00
3c0: 00 00 00 00 00 00 00 00 00 00 00 00 00 00 00 00
3d0: 00 00 00 00 00 00 00 00 00 00 00 00 00 00 00 00
3e0: 00 00 00 00 00 00 00 00 00 00 00 00 00 00 00 00
3f0: 00 00 00 00 00 00 00 00 00 00 00 00 00 00 00 00
400: 00 00 00 00 00 00 00 00 00 00 00 00 00 00 00 00
410: 00 00 00 00 00 00 00 00 00 00 00 00 00 00 00 00
420: 00 00 00 00 00 00 00 00 00 00 00 00 00 00 00 00
430: 00 00 00 00 00 00 00 00 00 00 00 00 00 00 00 00
440: 00 00 00 00 00 00 00 00 00 00 00 00 00 00 00 00
450: 00 00 00 00 00 00 00 00 00 00 00 00 00 00 00 00
460: 00 00 00 00 00 00 00 00 00 00 00 00 00 00 00 00
470: 00 00 00 00 00 00 00 00 00 00 00 00 00 00 00 00
480: 00 00 00 00 00 00 00 00 00 00 00 00 00 00 00 00
490: 00 00 00 00 00 00 00 00 00 00 00 00 00 00 00 00
4a0: 00 00 00 00 00 00 00 00 00 00 00 00 00 00 00 00
4b0: 00 00 00 00 00 00 00 00 00 00 00 00 00 00 00 00
4c0: 00 00 00 00 00 00 00 00 00 00 00 00 00 00 00 00
4d0: 00 00 00 00 00 00 00 00 00 00 00 00 00 00 00 00
4e0: 00 00 00 00 00 00 00 00 00 00 00 00 00 00 00 00
4f0: 00 00 00 00 00 00 00 00 00 00 00 00 00 00 00 00
500: 00 00 00 00 00 00 00 00 00 00 00 00 00 00 00 00
510: 00 00 00 00 00 00 00 00 00 00 00 00 00 00 00 00
520: 00 00 00 00 00 00 00 00 00 00 00 00 00 00 00 00
530: 00 00 00 00 00 00 00 00 00 00 00 00 00 00 00 00
540: 00 00 00 00 00 00 00 00 00 00 00 00 00 00 00 00
550: 00 00 00 00 00 00 00 00 00 00 00 00 00 00 00 00
560: 00 00 00 00 00 00 00 00 00 00 00 00 00 00 00 00
570: 00 00 00 00 00 00 00 00 00 00 00 00 00 00 00 00
580: 00 00 00 00 00 00 00 00 00 00 00 00 00 00 00 00
590: 00 00 00 00 00 00 00 00 00 00 00 00 00 00 00 00
5a0: 00 00 00 00 00 00 00 00 00 00 00 00 00 00 00 00
5b0: 00 00 00 00 00 00 00 00 00 00 00 00 00 00 00 00
5c0: 00 00 00 00 00 00 00 00 00 00 00 00 00 00 00 00
5d0: 00 00 00 00 00 00 00 00 00 00 00 00 00 00 00 00
5e0: 00 00 00 00 00 00 00 00 00 00 00 00 00 00 00 00
5f0: 00 00 00 00 00 00 00 00 00 00 00 00 00 00 00 00
600: 00 00 00 00 00 00 00 00 00 00 00 00 00 00 00 00
610: 00 00 00 00 00 00 00 00 00 00 00 00 00 00 00 00
620: 00 00 00 00 00 00 00 00 00 00 00 00 00 00 00 00
630: 00 00 00 00 00 00 00 00 00 00 00 00 00 00 00 00
640: 00 00 00 00 00 00 00 00 00 00 00 00 00 00 00 00
650: 00 00 00 00 00 00 00 00 00 00 00 00 00 00 00 00
660: 00 00 00 00 00 00 00 00 00 00 00 00 00 00 00 00
670: 00 00 00 00 00 00 00 00 00 00 00 00 00 00 00 00
680: 00 00 00 00 00 00 00 00 00 00 00 00 00 00 00 00
690: 00 00 00 00 00 00 00 00 00 00 00 00 00 00 00 00
6a0: 00 00 00 00 00 00 00 00 00 00 00 00 00 00 00 00
6b0: 00 00 00 00 00 00 00 00 00 00 00 00 00 00 00 00
6c0: 00 00 00 00 00 00 00 00 00 00 00 00 00 00 00 00
6d0: 00 00 00 00 00 00 00 00 00 00 00 00 00 00 00 00
6e0: 00 00 00 00 00 00 00 00 00 00 00 00 00 00 00 00
6f0: 00 00 00 00 00 00 00 00 00 00 00 00 00 00 00 00
700: 00 00 00 00 00 00 00 00 00 00 00 00 00 00 00 00
710: 00 00 00 00 00 00 00 00 00 00 00 00 00 00 00 00
720: 00 00 00 00 00 00 00 00 00 00 00 00 00 00 00 00
730: 00 00 00 00 00 00 00 00 00 00 00 00 00 00 00 00
740: 00 00 00 00 00 00 00 00 00 00 00 00 00 00 00 00
750: 00 00 00 00 00 00 00 00 00 00 00 00 00 00 00 00
760: 00 00 00 00 00 00 00 00 00 00 00 00 00 00 00 00
770: 00 00 00 00 00 00 00 00 00 00 00 00 00 00 00 00
780: 00 00 00 00 00 00 00 00 00 00 00 00 00 00 00 00
790: 00 00 00 00 00 00 00 00 00 00 00 00 00 00 00 00
7a0: 00 00 00 00 00 00 00 00 00 00 00 00 00 00 00 00
7b0: 00 00 00 00 00 00 00 00 00 00 00 00 00 00 00 00
7c0: 00 00 00 00 00 00 00 00 00 00 00 00 00 00 00 00
7d0: 00 00 00 00 00 00 00 00 00 00 00 00 00 00 00 00
7e0: 00 00 00 00 00 00 00 00 00 00 00 00 00 00 00 00
7f0: 00 00 00 00 00 00 00 00 00 00 00 00 00 00 00 00
800: 00 00 00 00 00 00 00 00 00 00 00 00 00 00 00 00
810: 00 00 00 00 00 00 00 00 00 00 00 00 00 00 00 00
820: 00 00 00 00 00 00 00 00 00 00 00 00 00 00 00 00
830: 00 00 00 00 00 00 00 00 00 00 00 00 00 00 00 00
840: 00 00 00 00 00 00 00 00 00 00 00 00 00 00 00 00
850: 00 00 00 00 00 00 00 00 00 00 00 00 00 00 00 00
860: 00 00 00 00 00 00 00 00 00 00 00 00 00 00 00 00
870: 00 00 00 00 00 00 00 00 00 00 00 00 00 00 00 00
880: 00 00 00 00 00 00 00 00 00 00 00 00 00 00 00 00
890: 00 00 00 00 00 00 00 00 00 00 00 00 00 00 00 00
8a0: 00 00 00 00 00 00 00 00 00 00 00 00 00 00 00 00
8b0: 00 00 00 00 00 00 00 00 00 00 00 00 00 00 00 00
8c0: 00 00 00 00 00 00 00 00 00 00 00 00 00 00 00 00
8d0: 00 00 00 00 00 00 00 00 00 00 00 00 00 00 00 00
8e0: 00 00 00 00 00 00 00 00 00 00 00 00 00 00 00 00
8f0: 00 00 00 00 00 00 00 00 00 00 00 00 00 00 00 00
900: 00 00 00 00 00 00 00 00 00 00 00 00 00 00 00 00
910: 00 00 00 00 00 00 00 00 00 00 00 00 00 00 00 00
920: 00 00 00 00 00 00 00 00 00 00 00 00 00 00 00 00
930: 00 00 00 00 00 00 00 00 00 00 00 00 00 00 00 00
940: 00 00 00 00 00 00 00 00 00 00 00 00 00 00 00 00
950: 00 00 00 00 00 00 00 00 00 00 00 00 00 00 00 00
960: 00 00 00 00 00 00 00 00 00 00 00 00 00 00 00 00
970: 00 00 00 00 00 00 00 00 00 00 00 00 00 00 00 00
980: 00 00 00 00 00 00 00 00 00 00 00 00 00 00 00 00
990: 00 00 00 00 00 00 00 00 00 00 00 00 00 00 00 00
9a0: 00 00 00 00 00 00 00 00 00 00 00 00 00 00 00 00
9b0: 00 00 00 00 00 00 00 00 00 00 00 00 00 00 00 00
9c0: 00 00 00 00 00 00 00 00 00 00 00 00 00 00 00 00
9d0: 00 00 00 00 00 00 00 00 00 00 00 00 00 00 00 00
9e0: 00 00 00 00 00 00 00 00 00 00 00 00 00 00 00 00
9f0: 00 00 00 00 00 00 00 00 00 00 00 00 00 00 00 00
a00: 00 00 00 00 00 00 00 00 00 00 00 00 00 00 00 00
a10: 00 00 00 00 00 00 00 00 00 00 00 00 00 00 00 00
a20: 00 00 00 00 00 00 00 00 00 00 00 00 00 00 00 00
a30: 00 00 00 00 00 00 00 00 00 00 00 00 00 00 00 00
a40: 00 00 00 00 00 00 00 00 00 00 00 00 00 00 00 00
a50: 00 00 00 00 00 00 00 00 00 00 00 00 00 00 00 00
a60: 00 00 00 00 00 00 00 00 00 00 00 00 00 00 00 00
a70: 00 00 00 00 00 00 00 00 00 00 00 00 00 00 00 00
a80: 00 00 00 00 00 00 00 00 00 00 00 00 00 00 00 00
a90: 00 00 00 00 00 00 00 00 00 00 00 00 00 00 00 00
aa0: 00 00 00 00 00 00 00 00 00 00 00 00 00 00 00 00
ab0: 00 00 00 00 00 00 00 00 00 00 00 00 00 00 00 00
ac0: 00 00 00 00 00 00 00 00 00 00 00 00 00 00 00 00
ad0: 00 00 00 00 00 00 00 00 00 00 00 00 00 00 00 00
ae0: 00 00 00 00 00 00 00 00 00 00 00 00 00 00 00 00
af0: 00 00 00 00 00 00 00 00 00 00 00 00 00 00 00 00
b00: 00 00 00 00 00 00 00 00 00 00 00 00 00 00 00 00
b10: 00 00 00 00 00 00 00 00 00 00 00 00 00 00 00 00
b20: 00 00 00 00 00 00 00 00 00 00 00 00 00 00 00 00
b30: 00 00 00 00 00 00 00 00 00 00 00 00 00 00 00 00
b40: 00 00 00 00 00 00 00 00 00 00 00 00 00 00 00 00
b50: 00 00 00 00 00 00 00 00 00 00 00 00 00 00 00 00
b60: 00 00 00 00 00 00 00 00 00 00 00 00 00 00 00 00
b70: 00 00 00 00 00 00 00 00 00 00 00 00 00 00 00 00
b80: 00 00 00 00 00 00 00 00 00 00 00 00 00 00 00 00
b90: 00 00 00 00 00 00 00 00 00 00 00 00 00 00 00 00
ba0: 00 00 00 00 00 00 00 00 00 00 00 00 00 00 00 00
bb0: 00 00 00 00 00 00 00 00 00 00 00 00 00 00 00 00
bc0: 00 00 00 00 00 00 00 00 00 00 00 00 00 00 00 00
bd0: 00 00 00 00 00 00 00 00 00 00 00 00 00 00 00 00
be0: 00 00 00 00 00 00 00 00 00 00 00 00 00 00 00 00
bf0: 00 00 00 00 00 00 00 00 00 00 00 00 00 00 00 00
c00: 00 00 00 00 00 00 00 00 00 00 00 00 00 00 00 00
c10: 00 00 00 00 00 00 00 00 00 00 00 00 00 00 00 00
c20: 00 00 00 00 00 00 00 00 00 00 00 00 00 00 00 00
c30: 00 00 00 00 00 00 00 00 00 00 00 00 00 00 00 00
c40: 00 00 00 00 00 00 00 00 00 00 00 00 00 00 00 00
c50: 00 00 00 00 00 00 00 00 00 00 00 00 00 00 00 00
c60: 00 00 00 00 00 00 00 00 00 00 00 00 00 00 00 00
c70: 00 00 00 00 00 00 00 00 00 00 00 00 00 00 00 00
c80: 00 00 00 00 00 00 00 00 00 00 00 00 00 00 00 00
c90: 00 00 00 00 00 00 00 00 00 00 00 00 00 00 00 00
ca0: 00 00 00 00 00 00 00 00 00 00 00 00 00 00 00 00
cb0: 00 00 00 00 00 00 00 00 00 00 00 00 00 00 00 00
cc0: 00 00 00 00 00 00 00 00 00 00 00 00 00 00 00 00
cd0: 00 00 00 00 00 00 00 00 00 00 00 00 00 00 00 00
ce0: 00 00 00 00 00 00 00 00 00 00 00 00 00 00 00 00
cf0: 00 00 00 00 00 00 00 00 00 00 00 00 00 00 00 00
d00: 00 00 00 00 00 00 00 00 00 00 00 00 00 00 00 00
d10: 00 00 00 00 00 00 00 00 00 00 00 00 00 00 00 00
d20: 00 00 00 00 00 00 00 00 00 00 00 00 00 00 00 00
d30: 00 00 00 00 00 00 00 00 00 00 00 00 00 00 00 00
d40: 00 00 00 00 00 00 00 00 00 00 00 00 00 00 00 00
d50: 00 00 00 00 00 00 00 00 00 00 00 00 00 00 00 00
d60: 00 00 00 00 00 00 00 00 00 00 00 00 00 00 00 00
d70: 00 00 00 00 00 00 00 00 00 00 00 00 00 00 00 00
d80: 00 00 00 00 00 00 00 00 00 00 00 00 00 00 00 00
d90: 00 00 00 00 00 00 00 00 00 00 00 00 00 00 00 00
da0: 00 00 00 00 00 00 00 00 00 00 00 00 00 00 00 00
db0: 00 00 00 00 00 00 00 00 00 00 00 00 00 00 00 00
dc0: 00 00 00 00 00 00 00 00 00 00 00 00 00 00 00 00
dd0: 00 00 00 00 00 00 00 00 00 00 00 00 00 00 00 00
de0: 00 00 00 00 00 00 00 00 00 00 00 00 00 00 00 00
df0: 00 00 00 00 00 00 00 00 00 00 00 00 00 00 00 00
e00: 00 00 00 00 00 00 00 00 00 00 00 00 00 00 00 00
e10: 00 00 00 00 00 00 00 00 00 00 00 00 00 00 00 00
e20: 00 00 00 00 00 00 00 00 00 00 00 00 00 00 00 00
e30: 00 00 00 00 00 00 00 00 00 00 00 00 00 00 00 00
e40: 00 00 00 00 00 00 00 00 00 00 00 00 00 00 00 00
e50: 00 00 00 00 00 00 00 00 00 00 00 00 00 00 00 00
e60: 00 00 00 00 00 00 00 00 00 00 00 00 00 00 00 00
e70: 00 00 00 00 00 00 00 00 00 00 00 00 00 00 00 00
e80: 00 00 00 00 00 00 00 00 00 00 00 00 00 00 00 00
e90: 00 00 00 00 00 00 00 00 00 00 00 00 00 00 00 00
ea0: 00 00 00 00 00 00 00 00 00 00 00 00 00 00 00 00
eb0: 00 00 00 00 00 00 00 00 00 00 00 00 00 00 00 00
ec0: 00 00 00 00 00 00 00 00 00 00 00 00 00 00 00 00
ed0: 00 00 00 00 00 00 00 00 00 00 00 00 00 00 00 00
ee0: 00 00 00 00 00 00 00 00 00 00 00 00 00 00 00 00
ef0: 00 00 00 00 00 00 00 00 00 00 00 00 00 00 00 00
f00: 00 00 00 00 00 00 00 00 00 00 00 00 00 00 00 00
f10: 00 00 00 00 00 00 00 00 00 00 00 00 00 00 00 00
f20: 00 00 00 00 00 00 00 00 00 00 00 00 00 00 00 00
f30: 00 00 00 00 00 00 00 00 00 00 00 00 00 00 00 00
f40: 00 00 00 00 00 00 00 00 00 00 00 00 00 00 00 00
f50: 00 00 00 00 00 00 00 00 00 00 00 00 00 00 00 00
f60: 00 00 00 00 00 00 00 00 00 00 00 00 00 00 00 00
f70: 00 00 00 00 00 00 00 00 00 00 00 00 00 00 00 00
f80: 00 00 00 00 00 00 00 00 00 00 00 00 00 00 00 00
f90: 00 00 00 00 00 00 00 00 00 00 00 00 00 00 00 00
fa0: 00 00 00 00 00 00 00 00 00 00 00 00 00 00 00 00
fb0: 00 00 00 00 00 00 00 00 00 00 00 00 00 00 00 00
fc0: 00 00 00 00 00 00 00 00 00 00 00 00 00 00 00 00
fd0: 00 00 00 00 00 00 00 00 00 00 00 00 00 00 00 00
fe0: 00 00 00 00 00 00 00 00 00 00 00 00 00 00 00 00
ff0: 00 00 00 00 00 00 00 00 00 00 00 00 00 00 00 00

