superiotool r
Found Nuvoton NCT6776F/D (C) (id=0xc333) at 0x2e
Register dump:
idx    def    val
0x10:  0xff   0xff
0x11:  0xff   0xff
0x13:  0x00  [0xff]
0x14:  0x00  [0xff]
0x16:  0xff   0xff
0x17:  0xff   0xff
0x18:  0xff   0xff
0x19:  0xff   0xff
0x1a:  0xf0   0xf0
0x1b:  0x78  [0x79]
0x1c:  0x00   0x00
0x1d:  0x00   0x00
0x1e:  0xff   0xff
0x1f:  0xff   0xff
0x20:  0xc3   0xc3
0x21:  0x33   0x33
0x22:  0xff   0xff
0x23:  0x00   0x00
0x24:  0x64  [0x24]
0x25:  0x00   0x00
0x26:  (MM)   0x00
0x27:  0x00  [0x80]
0x28:  0x00   0x00
0x2a:  0xc0  [0x00]
0x2b:  0x00  [0x0a]
0x2c:  0x81  [0x80]
0x2d:  0x00   0x00
0x2e:  0x00   0x00
0x2f:  (MM)   0x00

LDN 0x00 (FDC)
idx    def    val
0x30:  0x01   0x01
0x60:  0x03   0x03
0x61:  0xf0   0xf0
0x70:  0x06   0x06
0x74:  0x02   0x02
0xf0:  0x0e   0x0e
0xf1:  0x00   0x00
0xf2:  0xff   0xff
0xf4:  0x00   0x00
0xf5:  0x00   0x00

LDN 0x01 (Parallel Port)
idx    def    val
0x30:  0x01  [0x00]
0x60:  0x03   0x03
0x61:  0x78   0x78
0x70:  0x07   0x07
0x74:  0x04   0x04
0xf0:  0x3f   0x3f

LDN 0x02 (UART A)
idx    def    val
0x30:  0x01  [0x00]
0x60:  0x03   0x03
0x61:  0xf8   0xf8
0x70:  0x04   0x04
0xf0:  0x00   0x00
0xf2:  0x00   0x00

LDN 0x03 (UART B, IR)
idx    def    val
0x30:  0x01  [0x00]
0x60:  0x02   0x02
0x61:  0xf8   0xf8
0x70:  0x03   0x03
0xf0:  0x00   0x00
0xf1:  0x00   0x00
0xf2:  0x00   0x00

LDN 0x05 (Keyboard Controller)
idx    def    val
0x30:  0x00  [0x01]
0x60:  0x00   0x00
0x61:  0x00  [0x60]
0x62:  0x00   0x00
0x63:  0x00  [0x64]
0x70:  0x00  [0x01]
0x72:  0x00  [0x0c]
0xf0:  0x83   0x83

LDN 0x06 (CIR)
idx    def    val
0x30:  0x00   0x00
0x60:  0x00   0x00
0x61:  0x00   0x00
0x70:  0x00   0x00
0xf0:  0x08   0x08
0xf1:  0x09   0x09
0xf2:  0x32   0x32
0xf3:  0x00   0x00

LDN 0x07 (GPIO6, GPIO7, GPIO8, GPIO9)
idx    def    val
0x30:  0x03   0x03
0xe0:  0xff  [0x33]
0xe1:  0x00  [0x33]
0xe2:  0x00   0x00
0xe3:  0x00  [0x3f]
0xe4:  0xef   0xef
0xe5:  0x00   0x00
0xe6:  0x00   0x00
0xe7:  0x00  [0xc3]
0xe8:  0xff  [0x0f]
0xe9:  0x00   0x00
0xea:  0x00   0x00
0xeb:  0x00  [0x0c]
0xec:  0x00  [0x0c]
0xed:  0x00   0x00
0xee:  0x00   0x00
0xf4:  0xff   0xff
0xf5:  0x00   0x00
0xf6:  0x00   0x00
0xf7:  0x00   0x00
0xf8:  0x00   0x00

LDN 0x08 (WDT1, GPIO0, GPIO1, GPIOA)
idx    def    val
0x30:  0x02  [0x0f]
0x60:  0x00  [0x0a]
0x61:  0x00  [0x30]
0xe0:  0xff  [0x80]
0xe1:  0x00  [0x80]
0xe2:  0x00   0x00
0xe3:  0x00  [0xe0]
0xe4:  0x00   0x00
0xf0:  0xff   0xff
0xf1:  0x00   0x00
0xf2:  0x00   0x00
0xf3:  0x00  [0x28]
0xf4:  0x00   0x00
0xf5:  0x00   0x00
0xf6:  0x00   0x00
0xf7:  0x00   0x00

LDN 0x09 (GPIO2, GPIO3, GPIO4, GPIO5)
idx    def    val
0x30:  0x04  [0xfe]
0xe0:  0xdf  [0x0c]
0xe1:  0x00   0x00
0xe2:  0x00   0x00
0xe3:  0x00  [0x0f]
0xe4:  0xff  [0x48]
0xe5:  0x00  [0x08]
0xe6:  0x00   0x00
0xe7:  0x00  [0x0a]
0xe8:  0x00  [0x40]
0xe9:  0x00   0x00
0xea:  0x00   0x00
0xeb:  0x00   0x00
0xee:  0x00   0x00
0xf0:  0xff   0xff
0xf1:  0x00  [0x40]
0xf2:  0x00   0x00
0xf4:  0xff   0xff
0xf5:  0x00   0x00
0xf6:  0x00   0x00
0xf7:  0x00   0x00
0xfe:  0x00   0x00

LDN 0x0a (ACPI)
idx    def    val
0xe0:  0x01  [0x06]
0xe1:  0x00  [0x0e]
0xe2:  0x00   0x00
0xe3:  0x00  [0x02]
0xe4:  0x00  [0x30]
0xe5:  0x02   0x02
0xe6:  0x1c  [0xcc]
0xe7:  0x00   0x00
0xe9:  0x00   0x00
0xee:  0x00   0x00
0xf0:  0x00  [0x20]
0xf2:  0x5c  [0x5d]
0xf3:  0x00   0x00
0xf4:  0x00   0x00
0xf6:  0x00   0x00
0xf7:  0xc0   0xc0
0xfe:  0x00   0x00

LDN 0x0b (Hardware Monitor, Front Panel LED)
idx    def    val
0x30:  0x00  [0x01]
0x60:  0x00  [0x0a]
0x61:  0x00   0x00
0x62:  0x00  [0x0a]
0x63:  0x00  [0x20]
0x70:  0x00   0x00
0xe0:  0x7f   0x7f
0xe1:  0x7f   0x7f
0xe2:  0xff   0xff
0xf0:  0x00   0x00
0xf1:  0x00   0x00
0xf2:  0x00   0x00
0xf5:  0x10   0x10
0xf6:  0x00   0x00
0xf7:  0x87  [0x47]
0xf8:  0x47  [0x40]
0xf9:  0x00   0x00
0xfa:  0x00   0x00

LDN 0x0d (VID)
idx    def    val
0xe0:  0x00   0x00
0xe1:  0x00   0x00
0xe2:  0x00   0x00
0xe3:  0x00   0x00
0xe4:  0x00   0x00
0xe5:  0x00   0x00
0xe6:  0x00   0x00
0xe9:  0x00   0x00
0xee:  0x88   0x88
0xef:  0x00   0x00
0xf0:  0x00   0x00
0xf4:  0x00   0x00
0xf5:  0x00   0x00

LDN 0x0e (CIR WAKE-UP)
idx    def    val
0x30:  0x00   0x00
0x60:  0x00  [0x02]
0x61:  0x00  [0x50]
0x70:  0x00   0x00

LDN 0x0f (GPIO Push-Pull or Open-drain)
idx    def    val
0xe0:  0xff   0xff
0xe1:  0xdf   0xdf
0xe2:  0xff   0xff
0xe3:  0xfe   0xfe
0xe4:  0xf6   0xf6
0xe5:  0xff   0xff
0xe6:  0xff   0xff
0xe7:  0xd3   0xd3
0xe8:  0xff   0xff
0xe9:  0x9f   0x9f
0xf0:  0x00   0x00
0xf1:  0x00   0x00
0xf2:  0x00   0x00

LDN 0x14 (SVID)
idx    def    val
0xe0:  0x00   0x00
0xe1:  0x80   0x80
0xe3:  0x00   0x00
0xe4:  0x00   0x00

LDN 0x16 (Deep Sleep)
idx    def    val
0x30:  0x20   0x20
0xe0:  0x20   0x20
0xe1:  0x04   0x04
0xe2:  0x05   0x05

LDN 0x17 (GPIOA)
idx    def    val
0xe0:  0x01   0x01
0xe1:  0x00  [0x01]
0xe2:  0x00   0x00
0xe3:  0x00  [0x01]
0xe4:  0x01   0x01
0xe5:  0x00   0x00

Bank 0:
    00 01 02 03 04 05 06 07 08 09 0a 0b 0c 0d 0e 0f 
00: 04 4d 04 33 00 ff ff ff ff ff ff ff ff ff ff ff 
01: 04 ff 00 4d 33 00 ff ff 40 00 00 00 00 80 00 00 
02: 69 7d d6 d6 80 7b 82 19 ff ff ff da 00 00 00 00 
03: 00 00 00 00 00 00 00 00 00 00 00 ff ff ff ff ff 
04: 01 de 40 ff ff 00 3a ff 2d ff ff ff 18 05 00 a3 
05: ff ff ff ff ff ff ff ff c1 ff ff ff ff 0e 0e ff 
06: 00 ff ff ff ff 01 00 ff ff ff ff ff ff ff ff ff 
07: 00 0a 00 1f 80 1f 80 7b 80 ff ff ff ff ff ff ff 
08: ff 03 1f 0f ff 3c 3c 3c 00 00 00 00 00 00 00 00 
09: 0a 00 00 00 00 0a 0a 0a 0a aa ef 80 ff 40 46 c4 
0a: 0e 01 00 00 ff 00 00 ff 00 00 80 66 66 06 01 01 
0b: 00 00 00 00 00 00 2e 00 1c 00 00 34 28 80 c4 ff 
0c: 01 00 00 00 00 00 00 00 00 05 07 ff ff ff ff ff 
0d: ff ff ff ff ff ff ff ff ff ff ff ff ff ff ff ff 
0e: ff ff ff ff ff ff ff ff ff ff ff ff ff ff ff ff 
0f: ff ff ff ff ff ff ff ff ff ff ff ff ff ff ff ff 
Bank 1:
    00 01 02 03 04 05 06 07 08 09 0a 0b 0c 0d 0e 0f 
00: 0c 41 42 0a 0a 01 01 3c ff 4d ff ff 00 ff ff ff 
01: ff ff ff ff ff ff ff ff ff ff ff ff ff ff ff ff 
02: 00 41 4a 4d 50 ff ff 4d b8 dc ff ff ff ff ff ff 
03: ff 00 ff ff 00 46 ff ff 00 81 02 01 1c 44 00 00 
04: ff ff ff ff ff a4 00 ff ff ff ff ff ff ff 01 ff 
05: 1d 00 00 4b 00 50 00 ff ff ff ff ff ff ff ff ff 
06: ff ff ff ff ff ff ff ff ff ff ff ff ff ff ff ff 
07: ff ff ff ff ff ff ff ff ff ff ff ff ff ff ff ff 
08: ff ff ff ff ff ff ff ff ff ff ff ff ff ff ff ff 
09: ff ff ff ff ff ff ff ff ff ff ff ff ff ff ff ff 
0a: ff ff ff ff ff ff ff ff ff ff ff ff ff ff ff ff 
0b: ff ff ff ff ff ff ff ff ff ff ff ff ff ff ff ff 
0c: ff ff ff ff ff ff ff ff ff ff ff ff ff ff ff ff 
0d: ff ff ff ff ff ff ff ff ff ff ff ff ff ff ff ff 
0e: ff ff ff ff ff ff ff ff ff ff ff ff ff ff ff ff 
0f: ff ff ff ff ff ff ff ff ff ff ff ff ff ff ff ff 
Bank 2:
    00 01 02 03 04 05 06 07 08 09 0a 0b 0c 0d 0e 0f 
00: 0c 41 42 0a 0a 01 01 3c ff 33 ff ff 00 ff ff ff 
01: ff ff ff ff ff ff ff ff ff ff ff ff ff ff ff ff 
02: 00 41 4a 4d 50 ff ff 33 ae d7 ff ff ff ff ff ff 
03: ff 00 ff ff 00 46 ff ff 00 82 02 01 21 44 00 00 
04: ff ff ff ff ff a9 02 ff ff ff ff ff ff ff 02 ff 
05: 1f 80 00 4b 00 50 00 ff ff ff ff ff ff ff ff ff 
06: ff ff ff ff ff ff ff ff ff ff ff ff ff ff ff ff 
07: ff ff ff ff ff ff ff ff ff ff ff ff ff ff ff ff 
08: ff ff ff ff ff ff ff ff ff ff ff ff ff ff ff ff 
09: ff ff ff ff ff ff ff ff ff ff ff ff ff ff ff ff 
0a: ff ff ff ff ff ff ff ff ff ff ff ff ff ff ff ff 
0b: ff ff ff ff ff ff ff ff ff ff ff ff ff ff ff ff 
0c: ff ff ff ff ff ff ff ff ff ff ff ff ff ff ff ff 
0d: ff ff ff ff ff ff ff ff ff ff ff ff ff ff ff ff 
0e: ff ff ff ff ff ff ff ff ff ff ff ff ff ff ff ff 
0f: ff ff ff ff ff ff ff ff ff ff ff ff ff ff ff ff 
Bank 3:
    00 01 02 03 04 05 06 07 08 09 0a 0b 0c 0d 0e 0f 
00: 03 10 00 0a 0a 01 01 3c ff ff ff ff 00 ff ff ff 
01: ff ff ff ff ff ff ff ff ff ff ff ff ff ff ff ff 
02: 00 19 23 2d 37 ff ff 8c aa c8 e6 ff ff ff ff ff 
03: ff 00 ff ff 00 3c ff ff 00 01 00 00 00 00 00 00 
04: ff ff ff ff ff a4 00 ff ff ff ff ff ff ff 03 ff 
05: ff ff ff ff ff ff ff ff ff ff ff ff ff ff ff ff 
06: ff ff ff ff ff ff ff ff ff ff ff ff ff ff ff ff 
07: ff ff ff ff ff ff ff ff ff ff ff ff ff ff ff ff 
08: ff ff ff ff ff ff ff ff ff ff ff ff ff ff ff ff 
09: ff ff ff ff ff ff ff ff ff ff ff ff ff ff ff ff 
0a: ff ff ff ff ff ff ff ff ff ff ff ff ff ff ff ff 
0b: ff ff ff ff ff ff ff ff ff ff ff ff ff ff ff ff 
0c: ff ff ff ff ff ff ff ff ff ff ff ff ff ff ff ff 
0d: ff ff ff ff ff ff ff ff ff ff ff ff ff ff ff ff 
0e: ff ff ff ff ff ff ff ff ff ff ff ff ff ff ff ff 
0f: ff ff ff ff ff ff ff ff ff ff ff ff ff ff ff ff 
Bank 4:
    00 01 02 03 04 05 06 07 08 09 0a 0b 0c 0d 0e 0f 
00: 2c 00 00 00 00 00 00 00 00 00 00 00 00 00 00 00 
01: 00 00 00 00 00 00 00 00 00 00 00 ff ff ff ff ff 
02: ff ff ff 96 64 96 64 e1 96 ff ff ff ff ff ff ff 
03: ff ff ff ff ff ff ff ff ff ff ff ff ff ff ff ff 
04: 3f 07 00 ff ff ff ff ff ff ff ff ff ff ff 04 ff 
05: 31 13 ff ff 00 00 00 ff 02 de 1f b1 09 ff ff ff 
06: ff 01 00 00 00 00 00 00 ff ff ff ff ff ff ff ff 
07: ff ff ff ff ff ff ff ff ff ff ff ff ff ff ff ff 
08: ff ff ff ff ff ff ff ff ff ff ff ff ff ff ff ff 
09: ff ff ff ff ff ff ff ff ff ff ff ff ff ff ff ff 
0a: ff ff ff ff ff ff ff ff ff ff ff ff ff ff ff ff 
0b: ff ff ff ff ff ff ff ff ff ff ff ff ff ff ff ff 
0c: ff ff ff ff ff ff ff ff ff ff ff ff ff ff ff ff 
0d: ff ff ff ff ff ff ff ff ff ff ff ff ff ff ff ff 
0e: ff ff ff ff ff ff ff ff ff ff ff ff ff ff ff ff 
0f: ff ff ff ff ff ff ff ff ff ff ff ff ff ff ff ff 
Bank 5:
    00 01 02 03 04 05 06 07 08 09 0a 0b 0c 0d 0e 0f 
00: ff ff 00 00 00 00 ff ff ff ff ff ff ff 00 00 ff 
01: ff ff ff ff ff ff ff ff ff ff ff ff ff ff ff ff 
02: ff ff ff ff ff ff ff ff ff ff ff ff ff ff ff ff 
03: ff ff ff ff ff ff ff ff ff ff ff ff ff ff ff ff 
04: ff ff ff ff ff ff ff ff ff ff ff ff ff ff 05 ff 
05: c5 00 00 ff 00 00 00 00 ff ff ff ff ff ff ff ff 
06: 00 00 00 00 00 00 07 01 01 ff ff ff ff ff ff ff 
07: ff ff ff ff ff ff ff ff ff ff ff ff ff ff ff ff 
08: ff ff ff ff ff ff ff ff ff ff ff ff ff ff ff ff 
09: ff ff ff ff ff ff ff ff ff ff ff ff ff ff ff ff 
0a: ff ff ff ff ff ff ff ff ff ff ff ff ff ff ff ff 
0b: ff ff ff ff ff ff ff ff ff ff ff ff ff ff ff ff 
0c: ff ff ff ff ff ff ff ff ff ff ff ff ff ff ff ff 
0d: ff ff ff ff ff ff ff ff ff ff ff ff ff ff ff ff 
0e: ff ff ff ff ff ff ff ff ff ff ff ff ff ff ff ff 
0f: ff ff ff ff ff ff ff ff ff ff ff ff ff ff ff ff 
Bank 6:
    00 01 02 03 04 05 06 07 08 09 0a 0b 0c 0d 0e 0f 
00: 00 00 ff ff ff ff ff ff ff ff ff ff ff ff ff ff 
01: ff ff ff ff ff ff ff ff ff ff ff ff ff ff ff ff 
02: ff 01 02 0c 0e 0d 01 ff 00 00 00 2c 00 19 00 ff 
03: ff 1f 3d 1c ff 1f ff 1f ff 1f 00 00 00 00 00 00 
04: 00 00 00 00 02 02 02 ff ff ff ff ff ff ff 06 ff 
05: 7f 7f 7f 7f 7f 7f 00 a4 02 a9 00 a4 00 a4 00 a4 
06: ff ff ff ff ff ff ff ff ff ff ff ff ff ff ff ff 
07: 7f 7f 50 4b 04 7f 7f 50 4b 04 7f 7f 50 4b 04 ff 
08: ff ff ff ff ff ff ff ff ff ff ff ff ff ff ff ff 
09: ff ff ff ff ff ff ff ff ff ff ff ff ff ff ff ff 
0a: ff ff ff ff ff ff ff ff ff ff ff ff ff ff ff ff 
0b: ff ff ff ff ff ff ff ff ff ff ff ff ff ff ff ff 
0c: ff ff ff ff ff ff ff ff ff ff ff ff ff ff ff ff 
0d: ff ff ff ff ff ff ff ff ff ff ff ff ff ff ff ff 
0e: ff ff ff ff ff ff ff ff ff ff ff ff ff ff ff ff 
0f: ff ff ff ff ff ff ff ff ff ff ff ff ff ff ff ff 
Bank 7:
    00 01 02 03 04 05 06 07 08 09 0a 0b 0c 0d 0e 0f 
00: ff 95 02 10 00 00 00 00 00 69 00 00 00 00 00 00 
01: 00 00 00 00 00 00 00 ed ba f8 80 f8 80 f8 80 01 
02: 1f 03 06 00 00 00 ef 40 00 ef 00 00 00 00 00 00 
03: 00 00 00 ff ff ff ff ff ff ff ff ff ff ff ff ff 
04: ff ff ff ff ff ff ff ff ff ff ff ff ff ff 07 ff 
05: ff ff ff ff ff ff ff ff ff ff ff ff ff ff ff ff 
06: ff ff ff ff ff ff ff ff ff ff ff ff ff ff ff ff 
07: ff ff ff ff ff ff ff ff ff ff ff ff ff ff ff ff 
08: ff ff ff ff ff ff ff ff ff ff ff ff ff ff ff ff 
09: ff ff ff ff ff ff ff ff ff ff ff ff ff ff ff ff 
0a: ff ff ff ff ff ff ff ff ff ff ff ff ff ff ff ff 
0b: ff ff ff ff ff ff ff ff ff ff ff ff ff ff ff ff 
0c: ff ff ff ff ff ff ff ff ff ff ff ff ff ff ff ff 
0d: ff ff ff ff ff ff ff ff ff ff ff ff ff ff ff ff 
0e: ff ff ff ff ff ff ff ff ff ff ff ff ff ff ff ff 
0f: ff ff ff ff ff ff ff ff ff ff ff ff ff ff ff ff 
